CTRA,Coterra Energy Inc,ENERGY & TRANSPORTATION,CRUDE PETROLEUM & NATURAL GAS,NYSE,USD,USA,"840 GESSNER ROAD, SUITE 1400, HOUSTON, TX, US","Coterra Energy Inc., an independent oil and gas company, explores, exploits, develops, produces and markets oil and gas properties in the United States. The company is headquartered in Houston, Texas.",https://i.ibb.co/x6Y81R1/CTRA-forecast.png
CCI,Crown Castle,REAL ESTATE & CONSTRUCTION,REAL ESTATE INVESTMENT TRUSTS,NYSE,USD,USA,"1220 AUGUSTA DRIVE, SUITE 600, HOUSTON, TX, US","Crown Castle is a real estate investment trust and provider of shared communications infrastructure in the United States. Its network includes over 40,000 cell towers and nearly 80,000 route miles of fiber supporting small cells and fiber solutions. Headquartered in Houston, Texas, the company has 100 offices nationwide.",https://i.ibb.co/Tw6nvt2/CCI-forecast.png
CSX,CSX Corporation,ENERGY & TRANSPORTATION,"RAILROADS, LINE-HAUL OPERATING",NASDAQ,USD,USA,"500 WATER STREET, 15TH FLOOR, JACKSONVILLE, FL, US","CSX Corporation is an American holding company focused on rail transportation and real estate in North America, among other industries. Based in Richmond, Virginia, USA after the merger, in 2003 the CSX Corporation headquarters moved to Jacksonville, Florida.",https://i.ibb.co/cv6pN1t/CSX-forecast.png
CMI,Cummins Inc,TECHNOLOGY,ENGINES & TURBINES,NYSE,USD,USA,"500 JACKSON ST, BOX 3005 MAIL CODE 60207, COLUMBUS, IN, US","Cummins is a Columbus, Indiana based multinational corporation that designs, manufactures, and distributes engines, filtration, and power generation products. Cummins also services engines and related equipment, including fuel systems, controls, air handling, filtration, emission control, electrical power generation systems, and trucks.",https://i.ibb.co/Xtn3nCh/CMI-forecast.png
CVS,CVS Health Corp,TRADE & SERVICES,RETAIL-DRUG STORES AND PROPRIETARY STORES,NYSE,USD,USA,"ONE CVS DR., WOONSOCKET, RI, US","CVS Health (previously CVS Corporation and CVS Caremark Corporation) is an American healthcare company that owns CVS Pharmacy, a retail pharmacy chain; CVS Caremark, a pharmacy benefits manager; Aetna, a health insurance provider, among many other brands. The company's headquarters is in Woonsocket, Rhode Island.",https://i.ibb.co/F6jgXg8/CVS-forecast.png
DHI,DR Horton Inc,REAL ESTATE & CONSTRUCTION,OPERATIVE BUILDERS,NYSE,USD,USA,"D.R. HORTON TOWER, 301 COMMERCE STREET, SUITE 500, FORT WORTH, TX, US","D.R. Horton, Inc. is a home construction company incorporated in Delaware and headquartered in Arlington, Texas.",https://i.ibb.co/r0vKdwm/DHI-forecast.png
DHR,Danaher Corporation,LIFE SCIENCES,"INDUSTRIAL INSTRUMENTS FOR MEASUREMENT, DISPLAY, AND CONTROL",NYSE,USD,USA,"2200 PENNSYLVANIA AVE. N.W., SUITE 800W, WASHINGTON, DC, US","Danaher Corporation is an American globally diversified conglomerate with its headquarters in Washington, D.C.. The company designs, manufactures, and markets professional, medical, industrial, and commercial products and services. The company's 3 platforms are Life Sciences, Diagnostics, and Environmental & Applied Solutions.",https://i.ibb.co/p2n2M4C/DHR-forecast.png
DRI,Darden Restaurants Inc,TRADE & SERVICES,RETAIL-EATING PLACES,NYSE,USD,USA,"1000 DARDEN CENTER DRIVE, ORLANDO, FL, US","Darden Restaurants, Inc. is an American multi-brand restaurant operator headquartered in Orlando.",https://i.ibb.co/DLKRj39/DRI-forecast.png
DVA,DaVita HealthCare Partners Inc,LIFE SCIENCES,"SERVICES-MISC HEALTH & ALLIED SERVICES, NEC",NYSE,USD,USA,"2000 16TH STREET, DENVER, CO, US",DaVita Inc. provides kidney dialysis services through a network of outpatient dialysis centers in the United States.,https://i.ibb.co/VS3WT5w/DVA-forecast.png
DE,Deere & Company,TECHNOLOGY,FARM MACHINERY & EQUIPMENT,NYSE,USD,USA,"ONE JOHN DEERE PLACE, MOLINE, IL, US","John Deere is the brand name of Deere & Company, an American corporation that manufactures agricultural, construction, and forestry machinery, diesel engines, drivetrains (axles, transmissions, gearboxes) used in heavy equipment, and lawn care equipment.",https://i.ibb.co/z8Y45gh/DE-forecast.png
DAL,Delta Air Lines Inc,ENERGY & TRANSPORTATION,"AIR TRANSPORTATION, SCHEDULED",NYSE,USD,USA,"HARTSFIELD-JACKSON ATLANTA INTL AIRPORT, 1030 DELTA BOULEVARD, ATLANTA, GA, US","Delta Air Lines, Inc., typically referred to as Delta, is one of the major airlines of the United States and a legacy carrier. It is headquartered in Atlanta, Georgia.",https://i.ibb.co/GpB4W5w/DAL-forecast.png
XRAY,Dentsply Sirona Inc,LIFE SCIENCES,DENTAL EQUIPMENT & SUPPLIES,NASDAQ,USD,USA,"SUSQUEHANNA COMMERCE CENTER, 221 W. PHILADELPHIA STREET, YORK, PA, US",Dentsply Sirona is an American dental equipment manufacturer and dental consumables producer that markets its products in over 120 countries.,https://i.ibb.co/x3kBtzJ/XRAY-forecast.png
DVN,Devon Energy Corporation,ENERGY & TRANSPORTATION,CRUDE PETROLEUM & NATURAL GAS,NYSE,USD,USA,"333 W. SHERIDAN AVENUE, OKLAHOMA CITY, OK, US",Devon Energy Corporation is an American energy company engaged in hydrocarbon exploration in the American market.,https://i.ibb.co/x1y0VM5/DVN-forecast.png
DXCM,DexCom Inc,LIFE SCIENCES,SURGICAL & MEDICAL INSTRUMENTS & APPARATUS,NASDAQ,USD,USA,"6340 SEQUENCE DRIVE, SAN DIEGO, CA, US","DexCom, Inc. is a company that develops, manufactures, and distributes continuous glucose monitoring (CGM) systems for diabetes management. It operates internationally with headquarters in San Diego, California, and has a manufacturing facility in Mesa, Arizona.",https://i.ibb.co/r4YjDB4/DXCM-forecast.png
FANG,Diamondback Energy Inc,ENERGY & TRANSPORTATION,CRUDE PETROLEUM & NATURAL GAS,NASDAQ,USD,USA,"500 WEST TEXAS, SUITE 1210, MIDLAND, TX, US","Diamondback Energy is a company engaged in hydrocarbon exploration and headquartered in Midland, Texas.",https://i.ibb.co/bvT68QN/FANG-forecast.png
DLR,Digital Realty Trust Inc,REAL ESTATE & CONSTRUCTION,REAL ESTATE INVESTMENT TRUSTS,NYSE,USD,USA,"FOUR EMBARCADERO CENTER, SUITE 3200, SAN FRANCISCO, CA, US","Digital Realty Trust, Inc. is a real estate investment trust that invests in carrier-neutral data centers and provides colocation and peering services.",https://i.ibb.co/cJ2vg97/DLR-forecast.png
DFS,Discover Financial Services,FINANCE,PERSONAL CREDIT INSTITUTIONS,NYSE,USD,USA,"2500 LAKE COOK ROAD, RIVERWOODS, IL, US","Discover Financial Services is an American financial services company that owns and operates Discover Bank, which offers checking and savings accounts, personal loans, home equity loans, student loans and credit cards. It also owns and operates the Discover and Pulse networks, and owns Diners Club International. Discover is currently headquartered in the Chicago suburb of Riverwoods, Illinois.",https://i.ibb.co/FHSNpny/DFS-forecast.png
DG,Dollar General Corporation,TRADE & SERVICES,RETAIL-VARIETY STORES,NYSE,USD,USA,"100 MISSION RIDGE, GOODLETTSVILLE, TN, US","Dollar General Corporation is an American chain of variety stores headquartered in Goodlettsville, Tennessee.",https://i.ibb.co/VVyywWC/DG-forecast.png
DLTR,Dollar Tree Inc,TRADE & SERVICES,RETAIL-VARIETY STORES,NASDAQ,USD,USA,"500 VOLVO PARKWAY, N/A, CHESAPEAKE, VA, US","Dollar Tree is an American chain of discount variety stores that sells items for $1 or less, headquartered in Chesapeake, Virginia.",https://i.ibb.co/rkgvfTh/DLTR-forecast.png
D,Dominion Energy Inc,ENERGY & TRANSPORTATION,ELECTRIC SERVICES,NYSE,USD,USA,"120 TREDEGAR STREET, RICHMOND, VA, US","Dominion Energy, Inc., commonly referred to as Dominion, is an American power and energy company headquartered in Richmond, Virginia that supplies electricity in parts of Virginia, North Carolina, and South Carolina and supplies natural gas to parts of Utah, West Virginia, Ohio, Pennsylvania, North Carolina, South Carolina, and Georgia. Dominion also has generation facilities in Indiana, Illinois, Connecticut, and Rhode Island.",https://i.ibb.co/cwVv6zL/D-forecast.png
DPZ,Dominos Pizza Inc,TRADE & SERVICES,WHOLESALE-GROCERIES & RELATED PRODUCTS,NYSE,USD,USA,"30 FRANK LLOYD WRIGHT DRIVE, ANN ARBOR, MI, US","Domino's Pizza, Inc., branded as Domino's, is an American multinational pizza restaurant chain founded in 1960. The corporation is headquartered at the Domino's Farms Office Park in Ann Arbor, Michigan.",https://i.ibb.co/rfLRqTT/DPZ-forecast.png
DOV,Dover Corporation,TECHNOLOGY,"CONSTRUCTION, MINING & MATERIALS HANDLING MACHINERY & EQUIP",NYSE,USD,USA,"3005 HIGHLAND PARKWAY, SUITE 200, DOWNERS GROVE, IL, US","Dover Corporation is an American conglomerate manufacturer of industrial products. Founded in 1955 in New York City, Dover is now based in Downers Grove, Illinois.",https://i.ibb.co/CMRfgkb/DOV-forecast.png
DOW,Dow Inc,LIFE SCIENCES,"PLASTIC MATERIALS, SYNTH RESINS & NONVULCAN ELASTOMERS",NYSE,USD,USA,"2211 H.H. DOW WAY, MIDLAND, MI, US","Dow Inc. is an American commodity chemical company. The company is headquartered in Midland, Michigan.",https://i.ibb.co/y8QhyV6/DOW-forecast.png
DTE,DTE Energy Company,ENERGY & TRANSPORTATION,ELECTRIC SERVICES,NYSE,USD,USA,"ONE ENERGY PLAZA, DETROIT, MI, US",DTE Energy (formerly Detroit Edison until 1996) is a Detroit-based diversified energy company involved in the development and management of energy-related businesses and services in the United States and Canada.,https://i.ibb.co/41rwrNJ/DTE-forecast.png
DUK,Duke Energy Corporation,ENERGY & TRANSPORTATION,ELECTRIC & OTHER SERVICES COMBINED,NYSE,USD,USA,"550 SOUTH TRYON STREET, DEC45A, CHARLOTTE, NC, US","Duke Energy Corporation is an American electric power and natural gas holding company headquartered in Charlotte, North Carolina.",https://i.ibb.co/Gdpk1ks/DUK-forecast.png
DD,Dupont De Nemours Inc,LIFE SCIENCES,"PLASTIC MATERIALS, SYNTH RESINS & NONVULCAN ELASTOMERS",NYSE,USD,USA,"974 CENTRE ROAD, BUILDING 730, WILMINGTON, DE, US","DuPont de Nemours, Inc., commonly known as DuPont, is an American company formed by the merger of Dow Chemical and E. I. du Pont de Nemours and Company on August 31, 2017, and the subsequent spinoffs of Dow Inc. and Corteva. Prior to the spinoffs it was the world's largest chemical company in terms of sales.",https://i.ibb.co/myxjCrT/DD-forecast.png
DXC,DXC Technology Co,TECHNOLOGY,SERVICES-COMPUTER PROCESSING & DATA PREPARATION,NYSE,USD,USA,"1775 TYSONS BOULEVARD, TYSONS, VA, US",DXC Technology is an American multinational corporation that provides business-to-business information technology services.,https://i.ibb.co/SsWtdbV/DXC-forecast.png
EMN,Eastman Chemical Company,LIFE SCIENCES,"PLASTIC MATERIALS, SYNTH RESINS & NONVULCAN ELASTOMERS",NYSE,USD,USA,"PO BOX 511, 200 SOUTH WILCOX DRIVE, KINGSPORT, TN, US","Eastman Chemical Company is an American company primarily involved in the chemical industry. Once a subsidiary of Kodak, today it is an independent global specialty materials company that produces a broad range of advanced materials, chemicals and fibers for everyday purposes. The company is headquartered in Kingsport, Tennessee.",https://i.ibb.co/S72CTbs/EMN-forecast.png
ETN,Eaton Corporation PLC,TECHNOLOGY,MISC INDUSTRIAL & COMMERCIAL MACHINERY & EQUIPMENT,NYSE,USD,USA,"30 PEMBROKE ROAD, EATON HOUSE, DUBLIN, IE","Eaton Corporation plc is an American Irish-domiciled multinational power management company with 2020 sales of 17.86 billion USD, founded in the United States with corporate headquarters in Dublin, Ireland, and operational headquarters in Beachwood, Ohio.",https://i.ibb.co/XsNt8L4/ETN-forecast.png
EBAY,eBay Inc,TRADE & SERVICES,"SERVICES-BUSINESS SERVICES, NEC",NASDAQ,USD,USA,"2025 HAMILTON AVENUE, SAN JOSE, CA, US","eBay Inc. is an American multinational e-commerce corporation based in San Jose, California, that facilitates consumer-to-consumer and business-to-consumer sales through its website.",https://i.ibb.co/FY8Dp0s/EBAY-forecast.png
ECL,Ecolab Inc,LIFE SCIENCES,"SOAP, DETERGENTS, CLEANG PREPARATIONS, PERFUMES, COSMETICS",NYSE,USD,USA,"1 ECOLAB PLACE, SAINT PAUL, MN, US","Ecolab Inc., headquartered in St. Paul, Minnesota, is an American corporation that develops and offers services, technology and systems that specialize in water treatment, purification, cleaning and hygiene in a wide variety of applications. It helps organizations both private market as well as public treat their water, not only for drinking directly, but also for use in food, healthcare, hospitality related safety and industry.",https://i.ibb.co/DkRF4B3/ECL-forecast.png
EIX,Edison International,ENERGY & TRANSPORTATION,ELECTRIC SERVICES,NYSE,USD,USA,"2244 WALNUT GROVE AVE,, P O BOX 800, ROSEMEAD, CA, US","Edison International is a public utility holding company based in Rosemead, California. Its subsidiaries include Southern California Edison, and unregulated non-utility business assets Edison Energy.",https://i.ibb.co/w43nYgr/EIX-forecast.png
EW,Edwards Lifesciences Corp,LIFE SCIENCES,"ORTHOPEDIC, PROSTHETIC & SURGICAL APPLIANCES & SUPPLIES",NYSE,USD,USA,"ONE EDWARDS WAY, IRVINE, CA, US","Edwards Lifesciences is an American medical technology company headquartered in Irvine, California, specializing in artificial heart valves and hemodynamic monitoring.",https://i.ibb.co/0ygHzSZ/EW-forecast.png
EA,Electronic Arts Inc,TECHNOLOGY,SERVICES-PREPACKAGED SOFTWARE,NASDAQ,USD,USA,"209 REDWOOD SHORES PARKWAY, REDWOOD CITY, CA, US","Electronic Arts Inc. (EA) is an American video game company headquartered in Redwood City, California. It is the second-largest gaming company in the Americas and Europe by revenue and market capitalization after Activision Blizzard and ahead of Take-Two Interactive, and Ubisoft as of May 2020.",https://i.ibb.co/znHGVvQ/EA-forecast.png
LLY,Eli Lilly and Company,LIFE SCIENCES,PHARMACEUTICAL PREPARATIONS,NYSE,USD,USA,"LILLY CORPORATE CTR, DROP CODE 1094, INDIANAPOLIS, IN, US","Eli Lilly and Company is an American pharmaceutical company headquartered in Indianapolis, Indiana, with offices in 18 countries. Its products are sold in approximately 125 countries.",https://i.ibb.co/J3g2jJy/LLY-forecast.png
EMR,Emerson Electric Company,MANUFACTURING,ELECTRONIC & OTHER ELECTRICAL EQUIPMENT (NO COMPUTER EQUIP),NYSE,USD,USA,"8000 W FLORISSANT AVE, P O BOX 4100, ST LOUIS, MO, US","Emerson Electric Co. is an American multinational corporation headquartered in Ferguson, Missouri. The Fortune 500 company manufactures products and provides engineering services for a wide range of industrial, commercial, and consumer markets.",https://i.ibb.co/n76S62P/EMR-forecast.png
ENPH,Enphase Energy Inc,MANUFACTURING,SEMICONDUCTORS & RELATED DEVICES,NASDAQ,USD,USA,"47281 BAYSIDE PARKWAY, FREMONT, CA, US","Enphase Energy is an American energy technology company headquartered in Fremont, California. Enphase designs and manufactures software-driven home energy solutions that span solar generation, home energy storage and web-based monitoring and control.",https://i.ibb.co/J7Md8Ct/ENPH-forecast.png
ETR,Entergy Corporation,ENERGY & TRANSPORTATION,ELECTRIC SERVICES,NYSE,USD,USA,"639 LOYOLA AVE, NEW ORLEANS, LA, US",Entergy Corporation is a Fortune 500 integrated energy company engaged primarily in electric power production and retail distribution operations in the Deep South of the United States.,https://i.ibb.co/wKj2WGn/ETR-forecast.png
EOG,EOG Resources Inc,ENERGY & TRANSPORTATION,CRUDE PETROLEUM & NATURAL GAS,NYSE,USD,USA,"1111 BAGBY, SKY LOBBY 2, HOUSTON, TX, US","EOG Resources, Inc. is an American energy company engaged in hydrocarbon exploration. It is organized in Delaware and headquartered in the Heritage Plaza building in Houston, Texas.",https://i.ibb.co/Kwg8yNp/EOG-forecast.png
EFX,Equifax Inc,TRADE & SERVICES,"SERVICES-CONSUMER CREDIT REPORTING, COLLECTION AGENCIES",NYSE,USD,USA,"1550 PEACHTREE ST NW, ATLANTA, GA, US","Equifax Inc. is an American multinational consumer credit reporting agency and is one of the three largest consumer credit reporting agencies, along with Experian and TransUnion. In addition to credit and demographic data and services to business, Equifax sells credit monitoring and fraud prevention services directly to consumers.",https://i.ibb.co/Kjdt3YQ/EFX-forecast.png
EQIX,Equinix Inc,REAL ESTATE & CONSTRUCTION,REAL ESTATE INVESTMENT TRUSTS,NASDAQ,USD,USA,"ONE LAGOON DRIVE, REDWOOD CITY, CA, US","Equinix, Inc. is an American multinational company headquartered in Redwood City, California, that specializes in Internet connection and data centers.",https://i.ibb.co/PhgGDGV/EQIX-forecast.png
EQR,Equity Residential,REAL ESTATE & CONSTRUCTION,REAL ESTATE INVESTMENT TRUSTS,NYSE,USD,USA,"EQUITY RESIDENTIAL, TWO NORTH RIVERSIDE PLAZA, SUITE 400, CHICAGO, IL, US",Equity Residential is a publicly traded real estate investment trust that invests in apartments.,https://i.ibb.co/HgB5j7X/EQR-forecast.png
ESS,Essex Property Trust Inc,REAL ESTATE & CONSTRUCTION,REAL ESTATE INVESTMENT TRUSTS,NYSE,USD,USA,"1100 PARK PLACE, SUITE 200, SAN MATEO, CA, US","Essex Property Trust is a publicly traded real estate investment trust that invests in apartments, primarily on the West Coast of the United States.",https://i.ibb.co/FzBtyxr/ESS-forecast.png
EL,Estee Lauder Companies Inc,LIFE SCIENCES,"PERFUMES, COSMETICS & OTHER TOILET PREPARATIONS",NYSE,USD,USA,"767 FIFTH AVE, NEW YORK, NY, US","The Estee Lauder Companies Inc. is an American multinational manufacturer and marketer of prestige skincare, makeup, fragrance and hair care products, based in Midtown Manhattan, New York City. The company owns a diverse portfolio of brands, distributed internationally through both digital commerce and retail channels.",https://i.ibb.co/p16Typb/EL-forecast.png
ETSY,Etsy Inc,TRADE & SERVICES,"SERVICES-BUSINESS SERVICES, NEC",NASDAQ,USD,USA,"117 ADAMS STREET, BROOKLYN, NY, US","Etsy, Inc. is an American e-commerce company focused on handmade or vintage items and craft supplies. These items fall under a wide range of categories, including jewelry, bags, clothing, home decor and furniture, toys, art, as well as craft supplies and tools.",https://i.ibb.co/DkwpSZ3/ETSY-forecast.png
EVRG,Evergy Inc. Common Stock,ENERGY & TRANSPORTATION,ELECTRIC & OTHER SERVICES COMBINED,NASDAQ,USD,USA,"1200 MAIN STREET, KANSAS CITY, MO, US","Evergy is an American investor-owned utility (IOU) with publicly traded stock that has its headquarters in Topeka, Kansas, and in Kansas City, Missouri.",https://i.ibb.co/ssH77TY/EVRG-forecast.png
ES,Eversource Energy,ENERGY & TRANSPORTATION,ELECTRIC SERVICES,NYSE,USD,USA,"300 CADWELL DRIVE, SPRINGFIELD, MA, US","Eversource Energy is a publicly traded, Fortune 500 energy company headquartered in Hartford, Connecticut, and Boston, Massachusetts.",https://i.ibb.co/jGRtyhW/ES-forecast.png
EXC,Exelon Corporation,ENERGY & TRANSPORTATION,ELECTRIC & OTHER SERVICES COMBINED,NASDAQ,USD,USA,"PO BOX 805398, CHICAGO, IL, US","Exelon Corporation is an American Fortune 100 energy company headquartered in Chicago, Illinois and incorporated in Pennsylvania.",https://i.ibb.co/TrkXsNN/EXC-forecast.png
EXPE,Expedia Group Inc.,ENERGY & TRANSPORTATION,TRANSPORTATION SERVICES,NASDAQ,USD,USA,"1111 EXPEDIA GROUP WAY W., SEATTLE, WA, US","Expedia Group, Inc. is an American online travel shopping company for consumer and small business travel. Its websites, which are primarily travel fare aggregators and travel metasearch engines, include Expedia.com, Vrbo (previously HomeAway), Hotels.com, Hotwire.com, Orbitz, Travelocity, trivago and CarRentals.com.",https://i.ibb.co/LpBD37M/EXPE-forecast.png
EXPD,Expeditors International of Washington Inc,ENERGY & TRANSPORTATION,ARRANGEMENT OF TRANSPORTATION OF FREIGHT & CARGO,NASDAQ,USD,USA,"1015 THIRD AVENUE, SEATTLE, WA, US","Expeditors (Expeditors International of Washington) is an American worldwide logistics and freight forwarding company headquartered in Seattle, Washington.",https://i.ibb.co/NVFGK2Z/EXPD-forecast.png
EXR,Extra Space Storage Inc,REAL ESTATE & CONSTRUCTION,REAL ESTATE INVESTMENT TRUSTS,NYSE,USD,USA,"2795 COTTONWOOD PARKWAY, SUITE 400, SALT LAKE CITY, UT, US","Extra Space Storage is a real estate investment trust headquartered in Cottonwood Heights, Utah that invests in self storage units.",https://i.ibb.co/f43WCcv/EXR-forecast.png
XOM,Exxon Mobil Corp,ENERGY & TRANSPORTATION,PETROLEUM REFINING,NYSE,USD,USA,"5959 LAS COLINAS BLVD, IRVING, TX, US","Exxon Mobil Corporation, stylized as ExxonMobil, is an American multinational oil and gas corporation headquartered in Irving, Texas. It is the largest direct descendant of John D. Rockefeller's Standard Oil, and was formed on November 30, 1999 by the merger of Exxon (formerly the Standard Oil Company of New Jersey) and Mobil (formerly the Standard Oil Company of New York). ExxonMobil's primary brands are Exxon, Mobil, Esso, and ExxonMobil Chemical. ExxonMobil is incorporated in New Jersey.",https://i.ibb.co/CvwGBBk/XOM-forecast.png
FFIV,F5 Networks Inc,TECHNOLOGY,COMPUTER COMMUNICATIONS EQUIPMENT,NASDAQ,USD,USA,"401 ELLIOT AVE WEST, STE 500, SEATTLE, WA, US","F5, Inc. is an American company that specializes in application delivery networking (ADN), application availability & performance, multi-cloud management, application security, network security, access & authorization and online fraud prevention. F5 is headquartered in Seattle, Washington, with additional development, manufacturing, and administrative offices worldwide.",https://i.ibb.co/1vBHTHx/FFIV-forecast.png
FAST,Fastenal Company,TRADE & SERVICES,"RETAIL-BUILDING MATERIALS, HARDWARE, GARDEN SUPPLY",NASDAQ,USD,USA,"2001 THEURER BLVD, WINONA, MN, US","Fastenal Company is an American company based in Winona, Minnesota. Fastenal's service model centers on approximately 3,200 in-market locations, each providing custom inventory, and a dedicated sales team to support local businesses. Fastenal offers companies supply chain solutions that help business reduce inventory touches, and supply chain waste.",https://i.ibb.co/kmGPjxy/FAST-forecast.png
FRT,Federal Realty Investment Trust,REAL ESTATE & CONSTRUCTION,REAL ESTATE INVESTMENT TRUSTS,NYSE,USD,USA,"909 ROSE AVENUE, SUITE 200, NORTH BETHESDA, MD, US","Federal Realty Investment Trust is a real estate investment trust that invests in shopping centers in the Northeastern United States, the Mid-Atlantic states, California, and South Florida.",https://i.ibb.co/mTqSy1P/FRT-forecast.png
FDX,FedEx Corporation,ENERGY & TRANSPORTATION,AIR COURIER SERVICES,NYSE,USD,USA,"942 SOUTH SHADY GROVE ROAD, MEMPHIS, TN, US","FedEx Corporation, formerly Federal Express Corporation and later FDX Corporation, is an American multinational delivery services company headquartered in Memphis, Tennessee.",https://i.ibb.co/KKcW0LX/FDX-forecast.png
FIS,Fidelity National Information Services Inc,TRADE & SERVICES,"SERVICES-BUSINESS SERVICES, NEC",NYSE,USD,USA,"601 RIVERSIDE AVENUE, JACKSONVILLE, FL, US","FIS is an American Fortune 500 company which offers a wide range of financial products and services. Headquartered in Jacksonville, Florida, FIS employs approximately 63,000 people worldwide. FIS is most known for its development of Financial Technology, or FinTech, and as of Q2 2020 it offers its solutions in three primary segments: Merchant Solutions, Banking Solutions, and Capital Market Solutions.",https://i.ibb.co/R7MKcc6/FIS-forecast.png
FITB,Fifth Third Bancorp,FINANCE,STATE COMMERCIAL BANKS,NASDAQ,USD,USA,"38 FOUNTAIN SQ PLZ, FIFTH THIRD CENTER, CINCINNATI, OH, US","Fifth Third Bank is a bank headquartered in Cincinnati, Ohio, at Fifth Third Center. It is the principal subsidiary of Fifth Third Bancorp, a diversified bank holding company.",https://i.ibb.co/ZzftyCz/FITB-forecast.png
FE,FirstEnergy Corporation,ENERGY & TRANSPORTATION,ELECTRIC SERVICES,NYSE,USD,USA,"76 SOUTH MAIN ST, AKRON, OH, US","FirstEnergy Corp is an electric utility headquartered in Akron, Ohio. Its subsidiaries and affiliates are involved in the distribution, transmission, and generation of electricity, as well as energy management and other energy-related services.",https://i.ibb.co/p3jxCfs/FE-forecast.png
FLT,Fleetcor Technologies Inc,TRADE & SERVICES,"SERVICES-BUSINESS SERVICES, NEC",NYSE,USD,USA,"3280 PEACHTREE ROAD, SUITE 2400, ATLANTA, GA, US","FleetCor Technologies, Inc. or FLEETCOR provides fuel cards and workforce payment products and services.",https://i.ibb.co/LrHB03S/FLT-forecast.png
FMC,FMC Corporation,LIFE SCIENCES,CHEMICALS & ALLIED PRODUCTS,NYSE,USD,USA,"2929 WALNUT STREET, PHILADELPHIA, PA, US","FMC Corporation (Food Machinery and Chemical Corporation) is an American chemical manufacturing company headquartered in Philadelphia, Pennsylvania.",https://i.ibb.co/d26vjr4/FMC-forecast.png
F,Ford Motor Company,MANUFACTURING,MOTOR VEHICLES & PASSENGER CAR BODIES,NYSE,USD,USA,"ONE AMERICAN ROAD, DEARBORN, MI, US","Ford Motor Company, commonly known as Ford, is an American multinational automaker that has its main headquarters in Dearborn, Michigan.",https://i.ibb.co/bszPVg9/F-forecast.png
FTNT,Fortinet Inc,TECHNOLOGY,"COMPUTER PERIPHERAL EQUIPMENT, NEC",NASDAQ,USD,USA,"899 KIFER ROAD, SUNNYVALE, CA, US","Fortinet (Nasdaq: FTNT) is an American multinational corporation headquartered in Sunnyvale, California. It develops and sells cybersecurity solutions, including but not limited to physical products such as firewalls, plus software and services such as anti-virus protection, intrusion prevention systems and endpoint security components.",https://i.ibb.co/hfxfyM6/FTNT-forecast.png
FTV,Fortive Corp,LIFE SCIENCES,"INDUSTRIAL INSTRUMENTS FOR MEASUREMENT, DISPLAY, AND CONTROL",NYSE,USD,USA,"6920 SEAWAY BLVD., EVERETT, WA, US","Fortive is an American diversified industrial technology conglomerate company headquartered in Everett, Washington.",https://i.ibb.co/9Hxr59V/FTV-forecast.png
