NFLX,Netflix Inc,TRADE & SERVICES,SERVICES-VIDEO TAPE RENTAL,NASDAQ,USD,USA,"100 WINCHESTER CIRCLE, ., LOS GATOS, CA, US","Netflix, Inc. is an American over-the-top content platform and production company headquartered in Los Gatos, California. Netflix was founded in 1997 by Reed Hastings and Marc Randolph in Scotts Valley, California. The company's primary business is a subscription-based streaming service offering online streaming from a library of films and television series, including those produced in-house.",https://i.ibb.co/P59JZyD/NFLX-forecast.png
NWL,Newell Brands Inc,MANUFACTURING,"PLASTICS PRODUCTS, NEC",NASDAQ,USD,USA,"6655 PEACHTREE DUNWOODY ROAD, ATLANTA, GE","Newell Brands is an American worldwide manufacturer, marketer and distributor of consumer and commercial products with a portfolio of brands.",https://i.ibb.co/N6KLrCn/NWL-forecast.png
NEM,Newmont Goldcorp Corp,ENERGY & TRANSPORTATION,GOLD AND SILVER ORES,NYSE,USD,USA,"6363 SOUTH FIDDLERS GREEN CIRCLE, GREENWOOD VILLAGE, CO, US","Newmont Corporation, based in Greenwood Village, Colorado, United States, is one of the largest gold mining companies in the world.",https://i.ibb.co/2PkcWCY/NEM-forecast.png
NWSA,News Corp A,MANUFACTURING,NEWSPAPERS: PUBLISHING OR PUBLISHING & PRINTING,NASDAQ,USD,USA,"1211 AVENUE OF THE AMERICAS, NEW YORK, NY, US","News Corporation is an American mass media and publishing company operating across digital real estate information, news media, book publishing, and cable television.",https://i.ibb.co/M5kMGtT/NWSA-forecast.png
NWS,News Corp B,MANUFACTURING,NEWSPAPERS: PUBLISHING OR PUBLISHING & PRINTING,NASDAQ,USD,USA,"1211 AVENUE OF THE AMERICAS, NEW YORK, NY, US","News Corporation is an American mass media and publishing company operating across digital real estate information, news media, book publishing, and cable television.",https://i.ibb.co/TBDJ85s/NWS-forecast.png
NEE,Nextera Energy Inc,ENERGY & TRANSPORTATION,ELECTRIC SERVICES,NYSE,USD,USA,"700 UNIVERSE BLVD, JUNO BEACH, FL, US","NextEra Energy, Inc. is an American energy company with about 46 gigawatts of generating capacity, revenues of over $17 billion in 2017, and about 14,000 employees throughout the US and Canada. Its subsidiaries include Florida Power & Light (FPL), NextEra Energy Resources, NextEra Energy Partners, Gulf Power Company, and NextEra Energy Services.",https://i.ibb.co/R0qz8CX/NEE-forecast.png
NKE,Nike Inc,MANUFACTURING,RUBBER & PLASTICS FOOTWEAR,NYSE,USD,USA,"ONE BOWERMAN DR, BEAVERTON, OR, US","Nike, Inc. is an American multinational corporation that is engaged in the design, development, manufacturing, and worldwide marketing and sales of footwear, apparel, equipment, accessories, and services. The company is headquartered near Beaverton, Oregon, in the Portland metropolitan area. It is the world's largest supplier of athletic shoes and apparel and a major manufacturer of sports equipment.",https://i.ibb.co/FBSrDDQ/NKE-forecast.png
NI,NiSource Inc,ENERGY & TRANSPORTATION,ELECTRIC & OTHER SERVICES COMBINED,NYSE,USD,USA,"801 EAST 86TH AVE, MERRILLVILLE, IN, US","NiSource Inc. is one of the largest fully regulated utility companies in the United States. The company is based in Merrillville, Indiana.",https://i.ibb.co/r3N2hpy/NI-forecast.png
NSC,Norfolk Southern Corporation,ENERGY & TRANSPORTATION,"RAILROADS, LINE-HAUL OPERATING",NYSE,USD,USA,"THREE COMMERCIAL PL, NORFOLK, VA, US","The Norfolk Southern Railway is a Class I freight railroad in the United States, and is the current name of the former Southern Railway. With headquarters in Atlanta, Georgia, the company operates 19,420 route miles (31,250 km) in 22 eastern states, the District of Columbia, and has rights in Canada over the Albany to Montreal route of the Canadian Pacific Railway, and previously on CN from Buffalo to St. Thomas.",https://i.ibb.co/ZzdgvnC/NSC-forecast.png
NTRS,Northern Trust Corporation,FINANCE,STATE COMMERCIAL BANKS,NASDAQ,USD,USA,"50 S LASALLE ST, CHICAGO, IL, US","Northern Trust Corporation is a financial services company headquartered in Chicago, Illinois that caters to corporations, institutional investors, and ultra high net worth individuals.",https://i.ibb.co/2sKDKyC/NTRS-forecast.png
NOC,Northrop Grumman Corporation,MANUFACTURING,"SEARCH, DETECTION, NAVAGATION, GUIDANCE, AERONAUTICAL SYS",NYSE,USD,USA,"2980 FAIRVIEW PARK DRIVE, C/O NORTHROP GRUMMAN CORP, FALLS CHURCH, VA, US",Northrop Grumman Corporation (NYSE: NOC) is an American multinational aerospace and defense technology company.,https://i.ibb.co/RHR9vnM/NOC-forecast.png
NCLH,Norwegian Cruise Line Holdings Ltd,ENERGY & TRANSPORTATION,WATER TRANSPORTATION,NYSE,USD,USA,"7665 CORPORATE DRIVE, MIAMI, FL, US","Norwegian Cruise Line Holdings Ltd., is a cruise company in North America, Europe, Asia-Pacific and internationally. The company is headquartered in Miami, Florida.",https://i.ibb.co/drNtHHd/NCLH-forecast.png
NRG,NRG Energy Inc.,ENERGY & TRANSPORTATION,ELECTRIC SERVICES,NYSE,USD,USA,"804 CARNEGIE CENTER, -, PRINCETON, NJ, US","NRG Energy, Inc. is a large American energy company, headquartered in Houston, Texas. It was formerly the wholesale arm of Northern States Power Company (NSP), which became Xcel Energy, but became independent in 2000. NRG Energy is involved in energy generation and retail electricity.",https://i.ibb.co/8Md6XD1/NRG-forecast.png
NUE,Nucor Corp,MANUFACTURING,"STEEL WORKS, BLAST FURNACES & ROLLING MILLS (COKE OVENS)",NYSE,USD,USA,"1915 REXFORD RD, CHARLOTTE, NC, US","Nucor Corporation is a producer of steel and related products based in Charlotte, North Carolina.",https://i.ibb.co/JcCk0ZF/NUE-forecast.png
NVDA,NVIDIA Corporation,MANUFACTURING,SEMICONDUCTORS & RELATED DEVICES,NASDAQ,USD,USA,"2701 SAN TOMAS EXPRESSWAY, SANTA CLARA, CA, US","Nvidia Corporation is an American multinational technology company incorporated in Delaware and based in Santa Clara, California. It designs graphics processing units (GPUs) for the gaming and professional markets, as well as system on a chip units (SoCs) for the mobile computing and automotive market.",https://i.ibb.co/HzxTVXN/NVDA-forecast.png
NVR,NVR Inc,REAL ESTATE & CONSTRUCTION,OPERATIVE BUILDERS,NYSE,USD,USA,"11700 PLAZA AMERICA DR., SUITE 500, RESTON, VA, US","NVR, Inc. is a company engaged in home construction. It also operates a mortgage banking and title services business. The company primarily operates on the East Coast of the United States.",https://i.ibb.co/kHGmqK8/NVR-forecast.png
NXPI,NXP Semiconductors NV,MANUFACTURING,SEMICONDUCTORS & RELATED DEVICES,NASDAQ,USD,USA,", ","NXP Semiconductors N.V. is a Dutch semiconductor manufacturer with headquarters in Eindhoven, Netherlands.",https://i.ibb.co/M6LXYqn/NXPI-forecast.png
ORLY,OReilly Automotive Inc,TRADE & SERVICES,RETAIL-AUTO & HOME SUPPLY STORES,NASDAQ,USD,USA,"233 S PATTERSON AVE, SPRINGFIELD, MO, US","O'Reilly Auto Parts is an American auto parts retailer that provides automotive aftermarket parts, tools, supplies, equipment, and accessories in the United States serving both the professional service providers and do-it-yourself customers.",https://i.ibb.co/DwTBPb1/ORLY-forecast.png
OXY,Occidental Petroleum Corporation,ENERGY & TRANSPORTATION,CRUDE PETROLEUM & NATURAL GAS,NYSE,USD,USA,"5 GREENWAY PLAZA, SUITE 110, HOUSTON, TX, US","Occidental Petroleum Corporation is an American company engaged in hydrocarbon exploration in the United States, the Middle East, and Colombia as well as petrochemical manufacturing in the United States, Canada, and Chile.",https://i.ibb.co/pjB7wc3/OXY-forecast.png
ODFL,Old Dominion Freight Line Inc,ENERGY & TRANSPORTATION,TRUCKING (NO LOCAL),NASDAQ,USD,USA,"500 OLD DOMINION WAY, THOMASVILLE, NC, US","Old Dominion Freight Line, Inc. is an American less than truckload shipping (LTL) company. It offers regional, inter-regional and national LTL service. In addition to its core LTL services, the company offers logistics services including ground and air expedited transportation, supply chain consulting, transportation management, truckload brokerage, container delivery and warehousing, as well as household moving services.",https://i.ibb.co/128PVkM/ODFL-forecast.png
OMC,Omnicom Group Inc,TRADE & SERVICES,SERVICES-ADVERTISING AGENCIES,NYSE,USD,USA,"437 MADISON AVE, NEW YORK, NY, US","Omnicom Group Inc. is an American global media, marketing and corporate communications holding company, headquartered in New York City.",https://i.ibb.co/zb4LkS3/OMC-forecast.png
OKE,ONEOK Inc,ENERGY & TRANSPORTATION,NATURAL GAS TRANSMISISON & DISTRIBUTION,NYSE,USD,USA,"100 WEST 5TH ST, TULSA, OK, US","Oneok, Inc. is a diversified Fortune 500 energy corporation based in Tulsa, Oklahoma.",https://i.ibb.co/NCFZ4Tz/OKE-forecast.png
ORCL,Oracle Corporation,TECHNOLOGY,SERVICES-PREPACKAGED SOFTWARE,NYSE,USD,USA,"500 ORACLE PARKWAY, MAIL STOP 5 OP 7, REDWOOD CITY, CA, US","Oracle is an American multinational computer technology corporation headquartered in Austin, Texas. The company was formerly headquartered in Redwood Shores, California until December 2020 when it moved its headquarters to Texas. The company sells database software and technology, cloud engineered systems, and enterprise software products, particularly its own brands of database management systems.",https://i.ibb.co/Mh7Vc8c/ORCL-forecast.png
OGN,Organon & Co,LIFE SCIENCES,PHARMACEUTICAL PREPARATIONS,NYSE,USD,USA,"30 HUDSON STREET, FL 33, JERSEY CITY, NJ, US","Organon & Co. is an American pharmaceutical company headquartered in Jersey City, New Jersey. Organon specializes in the following core therapeutic fields: reproductive medicine, contraception, psychiatry, Hormone replacement therapy (HRT), and anesthesia. The company sells to international markets.",https://i.ibb.co/yNd84GH/OGN-forecast.png
OTIS,Otis Worldwide Corp,MANUFACTURING,ELECTRONIC & OTHER ELECTRICAL EQUIPMENT (NO COMPUTER EQUIP),NYSE,USD,USA,"ONE CARRIER PLACE, FARMINGTON, CT, US","Otis Worldwide Corporation is an American company that develops, manufactures and markets elevators, escalators, moving walkways, and related equipment.",https://i.ibb.co/3mj0B59/OTIS-forecast.png
PCAR,PACCAR Inc,MANUFACTURING,MOTOR VEHICLES & PASSENGER CAR BODIES,NASDAQ,USD,USA,"PACCAR BUILDING, 777 106TH AVENUE NE, BELLEVUE, WA, US","PACCAR Inc is an American Fortune 500 company and counts among the largest manufacturers of medium- and heavy-duty trucks in the world. PACCAR is engaged in the design, manufacture and customer support of light-, medium- and heavy-duty trucks under the Kenworth, Peterbilt, Leyland Trucks, and DAF nameplates. PACCAR also designs and manufactures powertrains, provides financial services and information technology, and distributes truck parts related to its principal business.",https://i.ibb.co/YfCH05L/PCAR-forecast.png
PKG,Packaging Corp of America,MANUFACTURING,PAPERBOARD CONTAINERS & BOXES,NYSE,USD,USA,"1955 W FIELD CT, LAKE FOREST, IL, US","Packaging Corporation of America is an American manufacturing company based in Lake Forest, Illinois.",https://i.ibb.co/gPRb1wT/PKG-forecast.png
PH,Parker-Hannifin Corporation,MANUFACTURING,MISCELLANEOUS FABRICATED METAL PRODUCTS,NYSE,USD,USA,"6035 PARKLAND BOULEVARD, CLEVELAND, OH, US","Parker-Hannifin Corporation, originally Parker Appliance Company, usually referred to as just Parker, is an American corporation specializing in motion and control technologies. Its corporate headquarters are in Mayfield Heights, Ohio, in Greater Cleveland.",https://i.ibb.co/G5vpFM5/PH-forecast.png
PAYX,Paychex Inc,TRADE & SERVICES,"SERVICES-ENGINEERING, ACCOUNTING, RESEARCH, MANAGEMENT",NASDAQ,USD,USA,"911 PANORAMA TRAIL S, ROCHESTER, NY, US","Paychex, Inc. is an American provider of human resource, payroll, and benefits outsourcing services for small- to medium-sized businesses.",https://i.ibb.co/9bS8Q8f/PAYX-forecast.png
PAYC,Paycom Soft,TECHNOLOGY,SERVICES-PREPACKAGED SOFTWARE,NYSE,USD,USA,"7501 W. MEMORIAL ROAD, OKLAHOMA CITY, OK, US","Paycom Software, Inc., known simply as Paycom, is an American online payroll and human resource technology provider based in Oklahoma City, Oklahoma.",https://i.ibb.co/JnSZBrm/PAYC-forecast.png
PYPL,PayPal Holdings Inc,TRADE & SERVICES,"SERVICES-BUSINESS SERVICES, NEC",NASDAQ,USD,USA,"2211 NORTH FIRST STREET, SAN JOSE, CA, US","PayPal Holdings, Inc. is an American company operating an online payments system in the majority of countries that support online money transfers, and serves as an electronic alternative to traditional paper methods like checks and money orders. The company operates as a payment processor for online vendors, auction sites, and many other commercial users, for which it charges a fee.",https://i.ibb.co/vYrpnPg/PYPL-forecast.png
PENN,Penn National Gaming Inc,REAL ESTATE & CONSTRUCTION,HOTELS & MOTELS,NASDAQ,USD,USA,"825 BERKSHIRE BLVD STE 200, WYOMISSING PROFESSIONAL CENTER, WYOMISSING, PA, US","Penn National Gaming, Inc. is an American operator of casinos and racetracks, based in Wyomissing, Pennsylvania.",https://i.ibb.co/6DGw3xB/PENN-forecast.png
PNR,Pentair PLC,TECHNOLOGY,SPECIAL INDUSTRY MACHINERY (NO METALWORKING MACHINERY),NYSE,USD,USA,"PO BOX 471, SHARP STREET, WALKDEN, MANCHESTER, GB","Pentair plc (PNR) is an American water treatment company with its main U.S. office in Minneapolis, Minnesota.",https://i.ibb.co/jy3tJ0H/PNR-forecast.png
PEP,PepsiCo Inc,MANUFACTURING,BEVERAGES,NASDAQ,USD,USA,"700 ANDERSON HILL RD, PURCHASE, NY, US","PepsiCo, Inc. is an American based multinational food, snack, and beverage corporation headquartered in Harrison, New York, in the hamlet of Purchase. PepsiCo's business encompasses all aspects of the food and beverage market. It oversees the manufacturing, distribution, and marketing of its products.",https://i.ibb.co/gRfwTfD/PEP-forecast.png
PFE,Pfizer Inc,LIFE SCIENCES,PHARMACEUTICAL PREPARATIONS,NYSE,USD,USA,"235 E 42ND ST, NEW YORK, NY, US","Pfizer Inc. is an American multinational pharmaceutical and biotechnology corporation headquartered on 42nd Street in Manhattan, New York City. The name of the company commemorates its co-founder, Charles Pfizer (1824-1906). Pfizer develops and produces medicines and vaccines for immunology, oncology, cardiology, endocrinology, and neurology. The company has several blockbuster drugs or products that each generate more than 1 billion USD in annual revenues.",https://i.ibb.co/RytH2Yt/PFE-forecast.png
PM,Philip Morris International Inc,MANUFACTURING,CIGARETTES,NYSE,USD,USA,"120 PARK AVENUE, NEW YORK, NY, US","Philip Morris International Inc. (PMI) is a Swiss-American multinational cigarette and tobacco manufacturing company, with products sold in over 180 countries. The most recognized and best selling product of the company is Marlboro.",https://i.ibb.co/rZtztmR/PM-forecast.png
PSX,Phillips 66,ENERGY & TRANSPORTATION,PETROLEUM REFINING,NYSE,USD,USA,"2331 CITYWEST BLVD., HOUSTON, TX, US","The Phillips 66 Company is an American multinational energy company headquartered in Westchase, Houston, Texas.",https://i.ibb.co/zNd2t3t/PSX-forecast.png
PNW,Pinnacle West Capital Corp,ENERGY & TRANSPORTATION,ELECTRIC SERVICES,NYSE,USD,USA,"400 NORTH FIFTH STREET, MS8695, PHOENIX, AZ, US",Pinnacle West Capital is a utility holding company that owns Arizona Public Service and Bright Canyon Energy.,https://i.ibb.co/HDwqdT7/PNW-forecast.png
PXD,Pioneer Natural Resources Co,ENERGY & TRANSPORTATION,CRUDE PETROLEUM & NATURAL GAS,NYSE,USD,USA,"777 HIDDEN RIDGE, IRVING, TX, US","Pioneer Natural Resources Company is a company engaged in hydrocarbon exploration headquartered in Irving, Texas. It operates in the Cline Shale, which is part of the Spraberry Trend of the Permian Basin, where the company is the largest acreage holder.",https://i.ibb.co/dPYhG3s/PXD-forecast.png
PNC,PNC Financial Services Group Inc,FINANCE,NATIONAL COMMERCIAL BANKS,NYSE,USD,USA,"THE TOWER AT PNC PLAZA, 300 FIFTH AVENUE, PITTSBURGH, PA, US","PNC Financial Services Group, Inc. (stylized as PNC) is a bank holding company and financial services corporation based in Pittsburgh, Pennsylvania. Its banking subsidiary, PNC Bank, operates in 21 states and the District of Columbia with 2,296 branches and 9,051 ATMs. The company also provides financial services such as asset management, wealth management, estate planning, loan servicing, and information processing.",https://i.ibb.co/MNrY2LY/PNC-forecast.png
POOL,Pool Corporation,TRADE & SERVICES,WHOLESALE-MISC DURABLE GOODS,NASDAQ,USD,USA,"109 NORTHPARK BLVD, 4TH FLOOR, COVINGTON, LA, US","Pool Corporation is a major distributor of swimming pool supplies, equipment, and related outdoor products.",https://i.ibb.co/cvQTdMc/POOL-forecast.png
PPG,PPG Industries Inc,LIFE SCIENCES,"PAINTS, VARNISHES, LACQUERS, ENAMELS & ALLIED PRODS",NYSE,USD,USA,"ONE PPG PL 40 EAST, PITTSBURGH, PA, US","PPG Industries, Inc. is an American Fortune 500 company and global supplier of paints, coatings, and specialty materials. With headquarters in Pittsburgh, Pennsylvania, PPG operates in more than 70 countries around the globe.",https://i.ibb.co/ZdR6v36/PPG-forecast.png
PPL,PPL Corporation,ENERGY & TRANSPORTATION,ELECTRIC SERVICES,NYSE,USD,USA,"TWO N NINTH ST, ALLENTOWN, PA, US","PPL Corporation is an energy company headquartered in Allentown, Pennsylvania, United States.",https://i.ibb.co/svnBBrQ/PPL-forecast.png
PFG,Principal Financial Group Inc,FINANCE,ACCIDENT & HEALTH INSURANCE,NASDAQ,USD,USA,"711 HIGH STREET, DES MOINES, IA, US","Principal Financial Group is an American global financial investment management and insurance company headquartered in Des Moines, Iowa.",https://i.ibb.co/tQt6Dn1/PFG-forecast.png
PG,Procter & Gamble Company,LIFE SCIENCES,"SOAP, DETERGENTS, CLEANG PREPARATIONS, PERFUMES, COSMETICS",NYSE,USD,USA,"ONE PROCTER & GAMBLE PLAZA, CINCINNATI, OH, US","The Procter & Gamble Company (P&G) is an American multinational consumer goods corporation headquartered in Cincinnati, Ohio, founded in 1837 by William Procter and James Gamble. It specializes in a wide range of personal health, consumer health, personal care, and hygiene products; these products are organized into several segments including Beauty; Grooming; Health Care; Fabric & Home Care; and Baby, Feminine, & Family Care. Before the sale of Pringles to Kellogg's, its product portfolio also included food, snacks, and beverages.",https://i.ibb.co/ys9nzgJ/PG-forecast.png
PGR,Progressive Corp,FINANCE,"FIRE, MARINE & CASUALTY INSURANCE",NYSE,USD,USA,"6300 WILSON MILLS RD, MAYFIELD VILLAGE, OH, US","The Progressive Corporation is an American insurance company, one of the largest providers of car insurance in the United States. The company insures motorcycles, boats, RVs, and commercial vehicles and provides home insurance through select companies.",https://i.ibb.co/DGgnTRZ/PGR-forecast.png
PLD,Prologis Inc,REAL ESTATE & CONSTRUCTION,REAL ESTATE INVESTMENT TRUSTS,NYSE,USD,USA,"PIER 1 BAY 1, SAN FRANCISCO, CA, US","Prologis, Inc. is a real estate investment trust headquartered in San Francisco, California that invests in logistics facilities, with a focus on the consumption side of the global supply chain.",https://i.ibb.co/rFpQ60S/PLD-forecast.png
PRU,Prudential Financial Inc,FINANCE,LIFE INSURANCE,NYSE,USD,USA,"751 BROAD ST, NEWARK, NJ, US","Prudential Financial, Inc. is an American company whose subsidiaries provide insurance, investment management, and other financial products and services to both retail and institutional customers throughout the United States and in over 40 other countries.",https://i.ibb.co/3hSbkF4/PRU-forecast.png
PTC,PTC Inc,TECHNOLOGY,SERVICES-PREPACKAGED SOFTWARE,NASDAQ,USD,USA,"140 KENDRICK STREET, NEEDHAM, MA, US","PTC Inc. is an American computer software and services company founded in 1985 and headquartered in Boston, Massachusetts.",https://i.ibb.co/HPJSJVK/PTC-forecast.png
PEG,Public Service Enterprise Group Inc,ENERGY & TRANSPORTATION,ELECTRIC & OTHER SERVICES COMBINED,NYSE,USD,USA,"CORPORATE ACCOUNTING SERVICES, 80 PARK PLAZA, 9TH FLOOR, NEWARK, NJ, US","The Public Service Enterprise Group (PSEG) is a publicly traded diversified energy company headquartered in Newark, New Jersey.",https://i.ibb.co/mbQXp2N/PEG-forecast.png
PSA,Public Storage,REAL ESTATE & CONSTRUCTION,REAL ESTATE INVESTMENT TRUSTS,NYSE,USD,USA,"701 WESTERN AVENUE, GLENDALE, CA, US","Public Storage is an American international self storage company headquartered in Glendale, California, that is run as a real estate investment trust (REIT).",https://i.ibb.co/2SH62Fv/PSA-forecast.png
PHM,PulteGroup Inc,REAL ESTATE & CONSTRUCTION,OPERATIVE BUILDERS,NYSE,USD,USA,"3350 PEACHTREE ROAD NORTHEAST, SUITE 150, ATLANTA, GE","PulteGroup, Inc. (previously known as Pulte Homes) is a home construction company based in Atlanta, Georgia, United States.",https://i.ibb.co/ft1H8W2/PHM-forecast.png
PVH,PVH Corp,MANUFACTURING,"MEN'S & BOYS' FURNISHGS, WORK CLOTHG, & ALLIED GARMENTS",NYSE,USD,USA,"200 MADISON AVENUE, NEW YORK, NY, US","PVH Corp., formerly known as the Phillips-Van Heusen Corporation, is an American clothing company which owns brands such as Van Heusen, Tommy Hilfiger, Calvin Klein, IZOD, Arrow, Warner's, Olga, True & Co., and Geoffrey Beene.",https://i.ibb.co/y52dHrd/PVH-forecast.png
QRVO,Qorvo Inc,MANUFACTURING,SEMICONDUCTORS & RELATED DEVICES,NASDAQ,USD,USA,"7628 THORNDIKE ROAD, GREENSBORO, NC, US","Qorvo is an American semiconductor company that designs, manufactures, and supplies radio-frequency systems for applications that drive wireless and broadband communications, as well as foundry services.",https://i.ibb.co/mhddb4b/QRVO-forecast.png
QCOM,Qualcomm Incorporated,MANUFACTURING,RADIO & TV BROADCASTING & COMMUNICATIONS EQUIPMENT,NASDAQ,USD,USA,"5775 MOREHOUSE DR, SAN DIEGO, CA, US","Qualcomm is an American multinational corporation headquartered in San Diego, California, and incorporated in Delaware. It creates semiconductors, software, and services related to wireless technology. It owns patents critical to the 5G, 4G, CDMA2000, TD-SCDMA and WCDMA mobile communications standards.",https://i.ibb.co/qmFF9TX/QCOM-forecast.png
PWR,Quanta Services Inc,REAL ESTATE & CONSTRUCTION,ELECTRICAL WORK,NYSE,USD,USA,"2800 POST OAK BLVD, SUITE 2600, HOUSTON, TX, US","Quanta Services is an American corporation that provides infrastructure services for electric power, pipeline, industrial and communications industries. Capabilities include the planning, design, installation, program management, maintenance and repair of most types of network infrastructure.",https://i.ibb.co/ncwQNcz/PWR-forecast.png
DGX,Quest Diagnostics Incorporated,LIFE SCIENCES,SERVICES-MEDICAL LABORATORIES,NYSE,USD,USA,"500 PLAZA DRIVE, SECAUCUS, NJ, US","Quest Diagnostics is an American clinical laboratory. A Fortune 500 company, Quest operates in the United States, Puerto Rico, Mexico, and Brazil. Quest also maintains collaborative agreements with various hospitals and clinics across the globe.",https://i.ibb.co/sm282qV/DGX-forecast.png
RL,Ralph Lauren Corp Class A,MANUFACTURING,"MEN'S & BOYS' FURNISHGS, WORK CLOTHG, & ALLIED GARMENTS",NYSE,USD,USA,"650 MADISON AVENUE, NEW YORK, NY, US","Ralph Lauren Corporation is an American fashion company producing products ranging from the mid-range to the luxury segments. They are known for the clothing, marketing and distribution of products in four categories: apparel, home, accessories, and fragrances.",https://i.ibb.co/BV7H13v/RL-forecast.png
RJF,Raymond James Financial Inc.,FINANCE,"SECURITY BROKERS, DEALERS & FLOTATION COMPANIES",NYSE,USD,USA,"880 CARILLON PKWY, ST PETERSBURG, FL, US","Raymond James Financial is an American multinational independent investment bank and financial services company providing financial services to individuals, corporations, and municipalities through its subsidiary companies that engage primarily in investment and financial planning, in addition to investment banking and asset management.",https://i.ibb.co/nCr5LGL/RJF-forecast.png
RTX,Raytheon Technologies Corp,MANUFACTURING,AIRCRAFT ENGINES & ENGINE PARTS,NYSE,USD,USA,"870 WINTER STREET, WALTHAM, MA, US","Raytheon Technologies Corporation is an American multinational aerospace and defense conglomerate headquartered in Waltham, Massachusetts. It is one of the largest aerospace, intelligence services providers, and defense manufacturers in the world by revenue and market capitalization. Raytheon Technologies (RTX) researches, develops, and manufactures advanced technology products in the aerospace and defense industry, including aircraft engines, avionics, aerostructures, cybersecurity, guided missiles, air defense systems, satellites, and drones.",https://i.ibb.co/HK55Mx6/RTX-forecast.png
O,Realty Income Corp,REAL ESTATE & CONSTRUCTION,REAL ESTATE INVESTMENT TRUSTS,NYSE,USD,USA,"11995 EL CAMINO REAL, SAN DIEGO, CA, US","Realty Income Corporation is a real estate investment trust that invests in free-standing, single-tenant commercial properties in the United States, Puerto Rico, and the United Kingdom that are subject to NNN Leases. The company is organized in Maryland with its headquarters in San Diego, California.",https://i.ibb.co/4PYG9vq/O-forecast.png
REG,Regency Centers Corporation,REAL ESTATE & CONSTRUCTION,REAL ESTATE INVESTMENT TRUSTS,NASDAQ,USD,USA,"ONE INDEPENDENT DRIVE, SUITE 114, JACKSONVILLE, FL, US","Regency Centers Corporation is a real estate investment trust based in Jacksonville, Florida and is one of the largest operators of shopping centers with grocery stores as anchor tenants.",https://i.ibb.co/tqDgdSy/REG-forecast.png
