MMM,3M Company,LIFE SCIENCES,SURGICAL & MEDICAL INSTRUMENTS & APPARATUS,NYSE,USD,USA,"3M CENTER, BLDG. 220-13E-26A, ST PAUL, MN, US","The 3M Company is an American multinational conglomerate corporation operating in the fields of industry, worker safety, US health care, and consumer goods. The company produces over 60,000 products under several brands, including adhesives, abrasives, laminates, passive fire protection, personal protective equipment, window films, paint protection films, dental and orthodontic products, electrical and electronic connecting and insulating materials, medical products, car-care products, electronic circuits, healthcare software and optical films. It is based in Maplewood, a suburb of Saint Paul, Minnesota.",https://i.ibb.co/JRnhrX7/MMM-forecast.png
AOS,Smith AO Corporation,MANUFACTURING,HOUSEHOLD APPLIANCES,NYSE,USD,USA,"11270 WEST PARK PLACE, MILWAUKEE, WI, US",A. O. Smith Corporation is an American manufacturer of both residential and commercial water heaters and boilers and the largest manufacturer and marketer of water heaters in North America. It also supplies water treatment products in the Asian market.,https://i.ibb.co/r4bCCjz/AOS-forecast.png
ABT,Abbott Laboratories,LIFE SCIENCES,PHARMACEUTICAL PREPARATIONS,NYSE,USD,USA,"100 ABBOTT PARK ROAD, ABBOTT PARK, IL, US","Abbott Laboratories is an American multinational medical devices and health care company with headquarters in Abbott Park, Illinois, United States. The company was founded by Chicago physician Wallace Calvin Abbott in 1888 to formulate known drugs; today, it sells medical devices, diagnostics, branded generic medicines and nutritional products. It split off its research-based pharmaceuticals business into AbbVie in 2013.",https://i.ibb.co/dPK50Fq/ABT-forecast.png
ABBV,AbbVie Inc,LIFE SCIENCES,PHARMACEUTICAL PREPARATIONS,NYSE,USD,USA,"1 NORTH WAUKEGAN ROAD, NORTH CHICAGO, IL, US",AbbVie is an American publicly traded biopharmaceutical company founded in 2013. It originated as a spin-off of Abbott Laboratories.,https://i.ibb.co/NZW36TW/ABBV-forecast.png
ACN,Accenture plc,TRADE & SERVICES,"SERVICES-BUSINESS SERVICES, NEC",NYSE,USD,USA,"1 GRAND CANAL SQUARE, GRAND CANAL HARBOUR, DUBLIN, IE","Accenture plc is an Irish-domiciled multinational company that provides consulting and processing services. It has been incorporated in Dublin, Ireland since 2009.",https://i.ibb.co/2vXHkgL/ACN-forecast.png
ADM,Archer-Daniels-Midland Company,MANUFACTURING,FATS & OILS,NYSE,USD,USA,"77 W. WACKER DR., CHICAGO, IL, US","The Archer-Daniels-Midland Company, commonly known as ADM, is an American multinational food processing and commodities trading corporation founded in 1902 and headquartered in Chicago, Illinois. The company operates more than 270 plants and 420 crop procurement facilities worldwide, where cereal grains and oilseeds are processed into products used in food, beverage, nutraceutical, industrial, and animal feed markets worldwide.",https://i.ibb.co/wpkQDrP/ADM-forecast.png
ADBE,Adobe Systems Incorporated,TECHNOLOGY,SERVICES-PREPACKAGED SOFTWARE,NASDAQ,USD,USA,"345 PARK AVE, SAN JOSE, CA, US","Adobe Inc. is an American multinational computer software company. Incorporated in Delaware and headquartered in San Jose, California, it has historically specialized in software for the creation and publication of a wide range of content, including graphics, photography, illustration, animation, multimedia, motion pictures and print. The company has expanded into digital marketing management software. Adobe has millions of users worldwide. Flagship products include: Photoshop image editing software, Adobe Illustrator vector-based illustration software, Adobe Acrobat Reader and the Portable Document Format (PDF), plus a host of tools primarily for audio-visual content creation, editing and publishing.",https://i.ibb.co/g9Z3mFd/ADBE-forecast.png
AAP,Advance Auto Parts Inc,TRADE & SERVICES,RETAIL-AUTO & HOME SUPPLY STORES,NYSE,USD,USA,"2635 EAST MILLBROOK ROAD, RALEIGH, NC, US","Advance Auto Parts, Inc. (Advance) is an American automotive aftermarket parts provider. Headquartered in Raleigh, North Carolina, it serves both professional installer and do-it-yourself (DIY) customers.",https://i.ibb.co/8gTFJF0/AAP-forecast.png
AMD,Advanced Micro Devices Inc,MANUFACTURING,SEMICONDUCTORS & RELATED DEVICES,NASDAQ,USD,USA,"2485 AUGUSTINE DRIVE, SANTA CLARA, CA, US","Advanced Micro Devices, Inc. (AMD) is an American multinational semiconductor company based in Santa Clara, California, that develops computer processors and related technologies for business and consumer markets. AMD's main products include microprocessors, motherboard chipsets, embedded processors and graphics processors for servers, workstations, personal computers and embedded system applications.",https://i.ibb.co/9YPSWXp/AMD-forecast.png
AES,The AES Corporation,ENERGY & TRANSPORTATION,COGENERATION SERVICES & SMALL POWER PRODUCERS,NYSE,USD,USA,"4300 WILSON BOULEVARD, ARLINGTON, VA, US","The AES Corporation is a Fortune 500 company that generates and distributes electrical power. AES is headquartered in Arlington, Virginia.",https://i.ibb.co/vPMK8sD/AES-forecast.png
AFL,Aflac Incorporated,FINANCE,ACCIDENT & HEALTH INSURANCE,NYSE,USD,USA,"1932 WYNNTON RD, COLUMBUS, GA, US",Aflac Inc. (American Family Life Assurance Company) is an American insurance company and is the largest provider of supplemental insurance in the United States.,https://i.ibb.co/ykQqjVG/AFL-forecast.png
A,Agilent Technologies Inc,LIFE SCIENCES,INSTRUMENTS FOR MEAS & TESTING OF ELECTRICITY & ELEC SIGNALS,NYSE,USD,USA,"5301 STEVENS CREEK BLVD, SANTA CLARA, CA, US","Agilent Technologies, Inc. is an American analytical instrumentation development and manufacturing company that offers its products and services to markets worldwide. Its global headquarters is located in Santa Clara, California.",https://i.ibb.co/mvwj9B6/A-forecast.png
APD,Air Products and Chemicals Inc,LIFE SCIENCES,INDUSTRIAL INORGANIC CHEMICALS,NYSE,USD,USA,"7201 HAMILTON BLVD, ALLENTOWN, PA, US","Air Products and Chemicals, Inc. is an American international corporation whose principal business is selling gases and chemicals for industrial uses. Air Products' headquarters is in Allentown, Pennsylvania.",https://i.ibb.co/hVRSgD1/APD-forecast.png
AKAM,Akamai Technologies Inc,TRADE & SERVICES,"SERVICES-BUSINESS SERVICES, NEC",NASDAQ,USD,USA,"145 BROADWAY, CAMBRIDGE, MA, US","Akamai Technologies, Inc. is a global content delivery network (CDN), cybersecurity, and cloud service company, providing web and Internet security services.",https://i.ibb.co/4f8JBgn/AKAM-forecast.png
ALK,Alaska Air Group Inc,ENERGY & TRANSPORTATION,"AIR TRANSPORTATION, SCHEDULED",NYSE,USD,USA,"19300 INTERNATIONAL BOULEVARD, SEATTLE, WA, US","Alaska Air Group is an airline holding company based in SeaTac, Washington, United States.",https://i.ibb.co/qCR3Mw0/ALK-forecast.png
ALB,Albemarle Corp,LIFE SCIENCES,"PLASTIC MATERIALS, SYNTH RESINS & NONVULCAN ELASTOMERS",NYSE,USD,USA,"4250 CONGRESS STREET, SUITE 900, CHARLOTTE, NC, US","Albemarle Corporation is a fine chemical manufacturing company based in Charlotte, North Carolina.",https://i.ibb.co/NpXRZB3/ALB-forecast.png
ARE,Alexandria Real Estate Equities Inc,REAL ESTATE & CONSTRUCTION,REAL ESTATE INVESTMENT TRUSTS,NYSE,USD,USA,"26 NORTH EUCLID AVENUE, PASADENA, CA, US","Alexandria Real Estate Equities, Inc. is an American real estate investment trust that invests in office buildings and laboratories leased to tenants in the life science and technology industries.",https://i.ibb.co/9ydFgMY/ARE-forecast.png
ALGN,Align Technology Inc,LIFE SCIENCES,"ORTHOPEDIC, PROSTHETIC & SURGICAL APPLIANCES & SUPPLIES",NASDAQ,USD,USA,"2820 ORCHARD PARKWAY, SAN JOSE, CA, US","Align Technology is a manufacturer of 3D digital scanners and the Invisalign clear aligners used in orthodontics. It is headquartered in San Jose, California.",https://i.ibb.co/0rc5yKv/ALGN-forecast.png
ALLE,Allegion PLC,TRADE & SERVICES,"SERVICES-DETECTIVE, GUARD & ARMORED CAR SERVICES",NYSE,USD,USA,"BLOCK D IVEAGH COURT, HARCOURT ROAD, DUBLIN 2, IE","Allegion plc is an American-Irish provider based in Dublin of security products, for homes and businesses. It comprises thirty one global brands, including CISA, Interflex, LCN, Schlage and Von Duprin.",https://i.ibb.co/3kgXDNL/ALLE-forecast.png
LNT,Alliant Energy Corp,ENERGY & TRANSPORTATION,ELECTRIC & OTHER SERVICES COMBINED,NASDAQ,USD,USA,"4902 NORTH BILTMORE LANE, SUITE 1000, MADISON, WI, US","Alliant Energy is a public utility holding company headquartered in Madison, Wisconsin providing power in Iowa and Wisconsin.",https://i.ibb.co/HHnPX4F/LNT-forecast.png
ALL,The Allstate Corporation,FINANCE,"FIRE, MARINE & CASUALTY INSURANCE",NYSE,USD,USA,"2775 SANDERS ROAD, NORTHBROOK, IL, US","The Allstate Corporation is an American insurance company, headquartered in Northfield Township, Illinois.",https://i.ibb.co/fvhzFsk/ALL-forecast.png
GOOGL,Alphabet Inc Class A,TECHNOLOGY,"SERVICES-COMPUTER PROGRAMMING, DATA PROCESSING, ETC.",NASDAQ,USD,USA,"1600 AMPHITHEATRE PARKWAY, MOUNTAIN VIEW, CA, US","Alphabet Inc. is an American multinational conglomerate headquartered in Mountain View, California. It was created through a restructuring of Google on October 2, 2015, and became the parent company of Google and several former Google subsidiaries. The two co-founders of Google remained as controlling shareholders, board members, and employees at Alphabet. Alphabet is the world's fourth-largest technology company by revenue and one of the world's most valuable companies.",https://i.ibb.co/F7QvHqr/GOOGL-forecast.png
GOOG,Alphabet Inc Class C,TECHNOLOGY,"SERVICES-COMPUTER PROGRAMMING, DATA PROCESSING, ETC.",NASDAQ,USD,USA,"1600 AMPHITHEATRE PARKWAY, MOUNTAIN VIEW, CA, US","Alphabet Inc. is an American multinational conglomerate headquartered in Mountain View, California. It was created through a restructuring of Google on October 2, 2015, and became the parent company of Google and several former Google subsidiaries. The two co-founders of Google remained as controlling shareholders, board members, and employees at Alphabet. Alphabet is the world's fourth-largest technology company by revenue and one of the world's most valuable companies.",https://i.ibb.co/BTmPR8T/GOOG-forecast.png
MO,Altria Group,MANUFACTURING,CIGARETTES,NYSE,USD,USA,"6601 WEST BROAD STREET, RICHMOND, VA, US","Altria Group, Inc. (previously known as Philip Morris Companies, Inc.) is an American corporation and one of the world's largest producers and marketers of tobacco, cigarettes and related products. It operates worldwide and is headquartered in unincorporated Henrico County, Virginia, just outside the city of Richmond.",https://i.ibb.co/vvJxk2W/MO-forecast.png
AMZN,Amazon.com Inc,TRADE & SERVICES,RETAIL-CATALOG & MAIL-ORDER HOUSES,NASDAQ,USD,USA,"410 TERRY AVENUE NORTH, SEATTLE, WA, US","Amazon.com, Inc. is an American multinational technology company which focuses on e-commerce, cloud computing, digital streaming, and artificial intelligence. It is one of the Big Five companies in the U.S. information technology industry, along with Google, Apple, Microsoft, and Facebook. The company has been referred to as one of the most influential economic and cultural forces in the world, as well as the world's most valuable brand.",https://i.ibb.co/PmGC2Py/AMZN-forecast.png
AMCR,Amcor PLC,MANUFACTURING,MISCELLANEOUS MANUFACTURING INDUSTRIES,NYSE,USD,USA,"83 TOWER ROAD NORTH, WARMLEY, BRISTOL, GB","Amcor plc is an Australian-American, UK-domiciled packaging company. It develops and produces flexible packaging, rigid containers, specialty cartons, closures and services for food, beverage, pharmaceutical, medical-device, home and personal-care, and other products.",https://i.ibb.co/C6JgT4w/AMCR-forecast.png
AEE,Ameren Corp,ENERGY & TRANSPORTATION,ELECTRIC & OTHER SERVICES COMBINED,NYSE,USD,USA,"1901 CHOUTEAU AVE, MC 1310, ST LOUIS, MO, US","Ameren Corporation is an American power company created December 31, 1997, by the merger of St. Louis, Missouri's Union Electric Company (formerly NYSE: UEP) and the neighboring Central Illinois Public Service Company (CIPSCO Inc. holding, formerly NYSE: CIP) of Springfield, Illinois. It is now a holding company for several power companies and energy companies.",https://i.ibb.co/ZBRxR5J/AEE-forecast.png
AAL,American Airlines Group,ENERGY & TRANSPORTATION,"AIR TRANSPORTATION, SCHEDULED",NASDAQ,USD,USA,"1 SKYVIEW DRIVE, FORT WORTH, TX, US","American Airlines Group Inc. is an American publicly traded airline holding company headquartered in Fort Worth, Texas.",https://i.ibb.co/f1r33MJ/AAL-forecast.png
AEP,American Electric Power Company Inc,ENERGY & TRANSPORTATION,ELECTRIC SERVICES,NASDAQ,USD,USA,"1 RIVERSIDE PLAZA, COLUMBUS, OH, US","American Electric Power (AEP) is a major investor-owned electric utility in the United States, delivering electricity to more than five million customers in 11 states.",https://i.ibb.co/cLBv63g/AEP-forecast.png
AXP,American Express Company,FINANCE,FINANCE SERVICES,NYSE,USD,USA,"200 VESEY STREET, 50TH FLOOR, NEW YORK, NY, US",The American Express Company is a multinational financial services corporation headquartered at 200 Vesey Street in the Battery Park City neighborhood of Lower Manhattan in New York City.,https://i.ibb.co/c1VSHCQ/AXP-forecast.png
AIG,American International Group Inc,FINANCE,"FIRE, MARINE & CASUALTY INSURANCE",NYSE,USD,USA,"175 WATER STREET, NEW YORK, NY, US","American International Group, Inc., also known as AIG, is an American multinational finance and insurance corporation with operations in more than 80 countries and jurisdictions. The company operates through three core businesses: General Insurance, Life & Retirement, and a standalone technology-enabled subsidiary.",https://i.ibb.co/417mzrs/AIG-forecast.png
AMT,American Tower Corp,REAL ESTATE & CONSTRUCTION,REAL ESTATE INVESTMENT TRUSTS,NYSE,USD,USA,"116 HUNTINGTON AVE, BOSTON, MA, US","American Tower Corporation (also referred to as American Tower or ATC) is an American real estate investment trust and an owner and operator of wireless and broadcast communications infrastructure in several countries worldwide and is headquartered in Boston, Massachusetts.",https://i.ibb.co/g7fkz7f/AMT-forecast.png
AWK,American Water Works,ENERGY & TRANSPORTATION,WATER SUPPLY,NYSE,USD,USA,"1 WATER STREET, CAMDEN, NJ, US",American Water is an American public utility company operating in the United States and Canada.,https://i.ibb.co/WPk2MgR/AWK-forecast.png
AMP,Ameriprise Financial Inc,FINANCE,INVESTMENT ADVICE,NYSE,USD,USA,"1099 AMERIPRISE FINANCIAL CENTER, MINNEAPOLIS, MN, US","Ameriprise Financial, Inc. is a diversified financial services company and bank holding company incorporated in Delaware and headquartered in Minneapolis, Minnesota. It provides financial planning products and services, including wealth management, asset management, insurance, annuities, and estate planning.",https://i.ibb.co/n1CBnv0/AMP-forecast.png
AME,Ametek Inc,LIFE SCIENCES,"INDUSTRIAL INSTRUMENTS FOR MEASUREMENT, DISPLAY, AND CONTROL",NYSE,USD,USA,"1100 CASSATT ROAD, BERWYN, PA, US","AMETEK, Inc. is an American global manufacturer of electronic instruments and electromechanical devices with a headquarters in the United States and over 220 manufacturing sites worldwide.",https://i.ibb.co/4ZZhkwx/AME-forecast.png
AMGN,Amgen Inc,LIFE SCIENCES,"BIOLOGICAL PRODUCTS, (NO DISGNOSTIC SUBSTANCES)",NASDAQ,USD,USA,"ONE AMGEN CENTER DRIVE, THOUSAND OAKS, CA, US","Amgen Inc. (formerly Applied Molecular Genetics Inc.) is an American multinational biopharmaceutical company headquartered in Thousand Oaks, California. Focused on molecular biology and biochemistry, its goal is to provide a healthcare business based on recombinant DNA technology.",https://i.ibb.co/VWChKKW/AMGN-forecast.png
APH,Amphenol Corporation,MANUFACTURING,ELECTRONIC CONNECTORS,NYSE,USD,USA,"358 HALL AVE, WALLINGFORD, CT, US","Amphenol Corporation is a major producer of electronic and fiber optic connectors, cable and interconnect systems such as coaxial cables. Amphenol is a portmanteau from the corporation's original name, American Phenolic Corp.",https://i.ibb.co/DWDv280/APH-forecast.png
ADI,Analog Devices Inc,MANUFACTURING,SEMICONDUCTORS & RELATED DEVICES,NASDAQ,USD,USA,"ONE TECHNOLOGY WAY, NORWOOD, MA, US","Analog Devices, Inc. (ADI), also known simply as Analog, is an American multinational semiconductor company specializing in data conversion, signal processing and power management technology, headquartered in Wilmington, Massachusetts.",https://i.ibb.co/nR20ZTS/ADI-forecast.png
ANSS,ANSYS Inc,TECHNOLOGY,SERVICES-PREPACKAGED SOFTWARE,NASDAQ,USD,USA,"2600 ANSYS DRIVE, SOUTHPOINTE, CANONSBURG, PA, US","Ansys, Inc. is an American company based in Canonsburg, Pennsylvania. It develops and markets multiphysics engineering simulation software for product design, testing and operation and offers its products and services to customers worldwide.",https://i.ibb.co/RPMTRRq/ANSS-forecast.png
AON,Aon PLC,FINANCE,"INSURANCE AGENTS, BROKERS & SERVICE",NYSE,USD,USA,"THE LEADENHALL BUILDING, 122 LEADENHALL STREET, LONDON, GB","Aon plc is a multinational professional services firm that sells a range of financial risk-mitigation products, including insurance, pension administration, and health-insurance plans.",https://i.ibb.co/PFhdSv9/AON-forecast.png
APA,APA Corporation,ENERGY & TRANSPORTATION,CRUDE PETROLEUM & NATURAL GAS,NASDAQ,USD,USA,"2000 POST OAK BLVD, STE 100, HOUSTON, TX, US","APA Corporation is the holding company for Apache Corporation, a company engaged in hydrocarbon exploration. It is organized in Delaware and headquartered in Houston.",https://i.ibb.co/GHG746X/APA-forecast.png
AAPL,Apple Inc,TECHNOLOGY,ELECTRONIC COMPUTERS,NASDAQ,USD,USA,"ONE INFINITE LOOP, CUPERTINO, CA, US","Apple Inc. is an American multinational technology company that specializes in consumer electronics, computer software, and online services. Apple is the world's largest technology company by revenue (totalling $274.5 billion in 2020) and, since January 2021, the world's most valuable company. As of 2021, Apple is the world's fourth-largest PC vendor by unit sales, and fourth-largest smartphone manufacturer. It is one of the Big Five American information technology companies, along with Amazon, Google, Microsoft, and Facebook.",https://i.ibb.co/mHk6Fbr/AAPL-forecast.png
AMAT,Applied Materials Inc,MANUFACTURING,SEMICONDUCTORS & RELATED DEVICES,NASDAQ,USD,USA,"3050 BOWERS AVE, SANTA CLARA, CA, US","Applied Materials, Inc. is an American corporation that supplies equipment, services and software for the manufacture of semiconductor (integrated circuit) chips for electronics, flat panel displays for computers, smartphones and televisions, and solar products. The company also supplies equipment to produce coatings for flexible electronics, packaging and other applications. The company is headquartered in Santa Clara, California, in Silicon Valley.",https://i.ibb.co/4jXQfNN/AMAT-forecast.png
APTV,Aptiv PLC,MANUFACTURING,MOTOR VEHICLE PARTS & ACCESSORIES,NYSE,USD,USA,"5 HANOVER QUAY, GRAND CANAL DOCK, DUBLIN, IE","Aptiv plc is an auto parts company headquartered in Dublin, Ireland.",https://i.ibb.co/9y9GMp0/APTV-forecast.png
ANET,Arista Networks,TECHNOLOGY,COMPUTER COMMUNICATIONS EQUIPMENT,NYSE,USD,USA,"5453 GREAT AMERICA PARKWAY, SANTA CLARA, CA, US","Arista Networks (formerly Arastra) is an American computer networking company headquartered in Santa Clara, California. The company designs and sells multilayer network switches to deliver software-defined networking (SDN) solutions for large datacenter, cloud computing, high-performance computing, and high-frequency trading environments.",https://i.ibb.co/vwBjSb3/ANET-forecast.png
AJG,Arthur J Gallagher & Co,FINANCE,"INSURANCE AGENTS, BROKERS & SERVICE",NYSE,USD,USA,"2850 GOLF ROAD, ROLLING MEADOWS, IL, US","Arthur J. Gallagher & Co. (AJG) is an American global insurance brokerage and risk management services firm headquartered in Rolling Meadows, Illinois.",https://i.ibb.co/c2GSD85/AJG-forecast.png
AIZ,Assurant Inc,FINANCE,ACCIDENT & HEALTH INSURANCE,NYSE,USD,USA,"28 LIBERTY STREET, 41ST FLOOR, NEW YORK, NY, US","Assurant, Inc. is a global provider of risk management products and services with headquarters in New York City.",https://i.ibb.co/GTZg1sG/AIZ-forecast.png
T,AT&T Inc,TECHNOLOGY,TELEPHONE COMMUNICATIONS (NO RADIOTELEPHONE),NYSE,USD,USA,"208 S. AKARD ST, ATTN : JAMES LACY, DALLAS, TX, US","AT&T Inc. is an American multinational conglomerate holding company, Delaware-registered but headquartered at Whitacre Tower in Downtown Dallas, Texas. It is the world largest telecommunications company, and the second largest provider of mobile telephone services.",https://i.ibb.co/VxmLVX8/T-forecast.png
ATO,Atmos Energy Corporation,ENERGY & TRANSPORTATION,NATURAL GAS DISTRIBUTION,NYSE,USD,USA,"1800 THREE LINCOLN CTR, 5430 LBJ FREEWAY, DALLAS, TX, US","Atmos Energy Corporation, headquartered in Dallas, Texas, is one of the United States' largest natural-gas-only distributors.",https://i.ibb.co/k27W3Rm/ATO-forecast.png
ADSK,Autodesk Inc,TECHNOLOGY,SERVICES-PREPACKAGED SOFTWARE,NASDAQ,USD,USA,"111 MCINNIS PKWY, SAN RAFAEL, CA, US","Autodesk, Inc. is an American multinational software corporation that makes software products and services for the architecture, engineering, construction, manufacturing, media, education, and entertainment industries. Autodesk is headquartered in San Rafael, California.",https://i.ibb.co/6yQpqDz/ADSK-forecast.png
ADP,Automatic Data Processing Inc,TECHNOLOGY,SERVICES-COMPUTER PROCESSING & DATA PREPARATION,NASDAQ,USD,USA,"ONE ADP BOULVARD, ROSELAND, NJ, US","Automatic Data Processing, Inc. (ADP) is an American provider of human resources management software and services.",https://i.ibb.co/4VtvkFL/ADP-forecast.png
AZO,AutoZone Inc,TRADE & SERVICES,RETAIL-AUTO & HOME SUPPLY STORES,NYSE,USD,USA,"123 SOUTH FRONT ST, MEMPHIS, TN, US","AutoZone, Inc. is an American retailer of aftermarket automotive parts and accessories, the largest in the United States.",https://i.ibb.co/W6STbsq/AZO-forecast.png
AVB,AvalonBay Communities Inc,REAL ESTATE & CONSTRUCTION,REAL ESTATE INVESTMENT TRUSTS,NYSE,USD,USA,"4040 WILSON BOULEVARD, STE 1000, ARLINGTON, VA, US","AvalonBay Communities, Inc. is a publicly traded real estate investment trust that invests in apartments.",https://i.ibb.co/7kg2Zfj/AVB-forecast.png
AVY,Avery Dennison Corp,MANUFACTURING,CONVERTED PAPER & PAPERBOARD PRODS (NO CONTANERS/BOXES),NYSE,USD,USA,"207 GOODE AVENUE, GLENDALE, CA, US","Avery Dennison Corporation is a multinational manufacturer and distributor of pressure-sensitive adhesive materials (such as self-adhesive labels), apparel branding labels and tags, RFID inlays, and specialty medical products. The company is headquartered in Glendale, California.",https://i.ibb.co/mCzPdcG/AVY-forecast.png
BKR,Baker Hughes Co,TECHNOLOGY,OIL & GAS FIELD MACHINERY & EQUIPMENT,NASDAQ,USD,USA,"17021 ALDINE WESTFIELD ROAD, HOUSTON, TX, US","Baker Hughes Company is an American international industrial service company and one of the world's largest oil field services companies. The company provides the oil and gas industry with products and services for oil drilling, formation evaluation, completion, production and reservoir consulting. Baker Hughes is headquartered in Houston.",https://i.ibb.co/ZzZvtpc/BKR-forecast.png
BAC,Bank of America Corp,FINANCE,NATIONAL COMMERCIAL BANKS,NYSE,USD,USA,"BANK OF AMERICA CORPORATE CENTER, 100 N TRYON ST, CHARLOTTE, NC, US","The Bank of America Corporation is an American multinational investment bank and financial services holding company headquartered in Charlotte, North Carolina. Founded in San Francisco, Bank of America was formed through NationsBank's acquisition of BankAmerica in 1998. It is the second largest banking institution in the United States, after JPMorgan Chase, and the eighth largest bank in the world. Bank of America is one of the Big Four banking institutions of the United States. It services approximately 10 percent of all American bank deposits, in direct competition with JPMorgan Chase, Citigroup and Wells Fargo. Its primary financial services revolve around commercial banking, wealth management, and investment banking.",https://i.ibb.co/W6Hbyfc/BAC-forecast.png
BBWI,Bath & Body Works Inc.,TRADE & SERVICES,RETAIL-WOMEN'S CLOTHING STORES,NYSE,USD,USA,"THREE LIMITED PKWY, P O BOX 16000, COLUMBUS, OH, US",None,https://i.ibb.co/cgH7n0F/BBWI-forecast.png
BAX,Baxter International Inc,LIFE SCIENCES,SURGICAL & MEDICAL INSTRUMENTS & APPARATUS,NYSE,USD,USA,"ONE BAXTER PKWY, DF2-1W, DEERFIELD, IL, US","Baxter International Inc. is an American multinational health care company with headquarters in Deerfield, Illinois. The company primarily focuses on products to treat hemophilia, kidney disease, immune disorders and other chronic and acute medical conditions. ",https://i.ibb.co/3yZsTMV/BAX-forecast.png
BDX,Becton Dickinson and Company,LIFE SCIENCES,SURGICAL & MEDICAL INSTRUMENTS & APPARATUS,NYSE,USD,USA,"ONE BECTON DR, FRANKLIN LAKES, NJ, US","Becton, Dickinson and Company, also known as BD, is an American multinational medical technology company that manufactures and sells medical devices, instrument systems, and reagents. BD also provides consulting and analytics services in certain geographies.",https://i.ibb.co/dPLCzN8/BDX-forecast.png
BBY,Best Buy Co. Inc,TRADE & SERVICES,"RETAIL-RADIO, TV & CONSUMER ELECTRONICS STORES",NYSE,USD,USA,"7601 PENN AVE SOUTH, RICHFIELD, MN, US","Best Buy Co., Inc. is an American multinational consumer electronics retailer headquartered in Richfield, Minnesota.",https://i.ibb.co/qJ9g3qQ/BBY-forecast.png
