KEYS,Keysight Technologies Inc,LIFE SCIENCES,"INDUSTRIAL INSTRUMENTS FOR MEASUREMENT, DISPLAY, AND CONTROL",NYSE,USD,USA,"1400 FOUNTAINGROVE PARKWAY, SANTA ROSA, CA, US","Keysight Technologies, or Keysight, is an American company that manufactures electronics test and measurement equipment and software.",https://i.ibb.co/bQ2hRx7/KEYS-forecast.png
KMB,Kimberly-Clark Corporation,MANUFACTURING,CONVERTED PAPER & PAPERBOARD PRODS (NO CONTANERS/BOXES),NYSE,USD,USA,"351 PHELPS DRIVE, IRVING, TX, US","Kimberly-Clark Corporation is an American multinational personal care corporation that produces mostly paper-based consumer products. The company manufactures sanitary paper products and surgical & medical instruments. Kimberly-Clark brand name products include Kleenex facial tissue, Kotex feminine hygiene products, Cottonelle, Scott and Andrex toilet paper, Wypall utility wipes, KimWipes scientific cleaning wipes and Huggies disposable diapers and baby wipes.",https://i.ibb.co/7zRnGmp/KMB-forecast.png
KIM,Kimco Realty Corporation,REAL ESTATE & CONSTRUCTION,REAL ESTATE INVESTMENT TRUSTS,NYSE,USD,USA,"3333 NEW HYDE PARK RD, PO BOX 5020, NEW HYDE PARK, NY, US",Kimco Realty Corporation is a real estate investment trust (REIT) that invests in shopping centers.,https://i.ibb.co/5YkyFf9/KIM-forecast.png
KMI,Kinder Morgan Inc,ENERGY & TRANSPORTATION,NATURAL GAS TRANSMISSION,NYSE,USD,USA,"1001 LOUISIANA STREET, SUITE 1000, HOUSTON, TX, US","Kinder Morgan, Inc. is one of the largest energy infrastructure companies in North America. The company specializes in owning and controlling oil and gas pipelines and terminals.",https://i.ibb.co/4K4qrWn/KMI-forecast.png
KLAC,KLA-Tencor Corporation,LIFE SCIENCES,OPTICAL INSTRUMENTS & LENSES,NASDAQ,USD,USA,"ONE TECHNOLOGY DRIVE, MILPITAS, CA, US","KLA Corporation is a capital equipment company based in Milpitas, California. It supplies process control and yield management systems for the semiconductor industry and other related nanoelectronics industries. The company's products and services are intended for all phases of wafer, reticle, integrated circuit (IC) and packaging production, from research and development to final volume manufacturing.",https://i.ibb.co/C0rGQ4n/KLAC-forecast.png
KHC,Kraft Heinz Co,MANUFACTURING,"CANNED, FROZEN & PRESERVD FRUIT, VEG & FOOD SPECIALTIES",NASDAQ,USD,USA,"ONE PPG PLACE, PITTSBURGH, PA, US","The Kraft Heinz Company (KHC), commonly known as Kraft Heinz, is an American food company formed by the merger of Kraft Foods and Heinz, co-headquartered in Chicago, Illinois, and Pittsburgh, Pennsylvania.",https://i.ibb.co/3WxhNj4/KHC-forecast.png
KR,Kroger Company,TRADE & SERVICES,RETAIL-GROCERY STORES,NYSE,USD,USA,"1014 VINE ST, CINCINNATI, OH, US","The Kroger Company, or simply Kroger, is an American retail company founded by Bernard Kroger in 1883 in Cincinnati, Ohio.",https://i.ibb.co/12KxbQz/KR-forecast.png
LHX,L3Harris Technologies Inc,MANUFACTURING,"SEARCH, DETECTION, NAVAGATION, GUIDANCE, AERONAUTICAL SYS",NYSE,USD,USA,"1025 W NASA BLVD, MELBOURNE, FL, US","L3Harris Technologies (L3Harris) is an American technology company, defense contractor and information technology services provider that produces C6ISR systems and products, wireless equipment, tactical radios, avionics and electronic systems, night vision equipment, and both terrestrial and spaceborne antennas for use in the government, defense, and commercial sectors.",https://i.ibb.co/3FmNjHB/LHX-forecast.png
LH,Laboratory Corporation of America Holdings,LIFE SCIENCES,SERVICES-MEDICAL LABORATORIES,NYSE,USD,USA,"358 S MAIN ST, BURLINGTON, NC, US","Laboratory Corporation of America Holdings, more commonly known as Labcorp, is an American company headquartered in Burlington, North Carolina. It operates one of the largest clinical laboratory networks in the world, with a United States network of 36 primary laboratories.",https://i.ibb.co/Vpz8cxP/LH-forecast.png
LRCX,Lam Research Corp,TECHNOLOGY,"SPECIAL INDUSTRY MACHINERY, NEC",NASDAQ,USD,USA,"4650 CUSHING BLVD, FREMONT, CA, US","Lam Research Corporation is an American corporation that engages in the design, manufacture, marketing, and service of semiconductor processing equipment used in the fabrication of integrated circuits. Its products are used primarily in front-end wafer processing, which involves the steps that create the active components of semiconductor devices (transistors, capacitors) and their wiring (interconnects). The company also builds equipment for back-end wafer-level packaging (WLP), and for related manufacturing markets such as for microelectromechanical systems (MEMS). The company is headquartered in Fremont, California, in the Silicon Valley.",https://i.ibb.co/JdR0n6h/LRCX-forecast.png
LW,Lamb Weston Holdings Inc,MANUFACTURING,"CANNED, FROZEN & PRESERVD FRUIT, VEG & FOOD SPECIALTIES",NYSE,USD,USA,"599 S. RIVERSHORE LANE, EAGLE, ID, US","Lamb Weston Holdings, Inc. is an American food processing company that is one of the world's largest producers and processors of frozen french fries and other frozen potato products. It is headquartered in Eagle, Idaho.",https://i.ibb.co/ft36ZWW/LW-forecast.png
LVS,Las Vegas Sands Corp,REAL ESTATE & CONSTRUCTION,HOTELS & MOTELS,NYSE,USD,USA,"3355 LAS VEGAS BOULEVARD, SOUTH, ROOM 1A, LAS VEGAS, NV, US","Las Vegas Sands Corporation is an American casino and resort company based in Paradise, Nevada, United States. Its resorts feature accommodations, gambling and entertainment, convention and exhibition facilities, restaurants and clubs, as well as an art and science museum in Singapore.",https://i.ibb.co/tB1K1M5/LVS-forecast.png
LEG,Leggett & Platt Incorporated,MANUFACTURING,HOUSEHOLD FURNITURE,NYSE,USD,USA,"NO. 1 LEGGETT ROAD, CARTHAGE, MO, US","Leggett & Platt (L&P), based in Carthage, Missouri, is a diversified manufacturer that designs and produces various engineered components and products.",https://i.ibb.co/tqng5Cd/LEG-forecast.png
LDOS,Leidos Holdings Inc,TECHNOLOGY,SERVICES-COMPUTER INTEGRATED SYSTEMS DESIGN,NYSE,USD,USA,"11951 FREEDOM DRIVE, RESTON, VA, US","Leidos, formerly known as Science Applications International Corporation (SAIC), is an American defense, aviation, information technology (Lockheed Martin IS&GS), and biomedical research company headquartered in Reston, Virginia, that provides scientific, engineering, systems integration, and technical services.",https://i.ibb.co/L86fpF5/LDOS-forecast.png
LEN,Lennar Corporation,REAL ESTATE & CONSTRUCTION,GENERAL BLDG CONTRACTORS - RESIDENTIAL BLDGS,NYSE,USD,USA,"700 NW 107TH AVENUE, SUITE 400, MIAMI, FL, US","Lennar Corporation is a home construction and real estate company based in Fontainebleau, Florida.",https://i.ibb.co/HFYDHjQ/LEN-forecast.png
LNC,Lincoln National Corporation,FINANCE,LIFE INSURANCE,NYSE,USD,USA,"150 N RADNOR CHESTER RD, RADNOR, PA, US","Lincoln National Corporation is an American holding company, which operates multiple insurance and investment management businesses through subsidiary companies. Lincoln Financial Group is the marketing name for LNC and its subsidiary companies.",https://i.ibb.co/Cmdbkzd/LNC-forecast.png
LIN,Linde plc Ordinary Shares,LIFE SCIENCES,INDUSTRIAL INORGANIC CHEMICALS,NASDAQ,USD,USA,"THE PRIESTLEY CENTRE, 10 PRIESTLEY RD, GUILDFORD, GB","Linde plc is a multinational chemical company. It is the largest industrial gas company by market share and revenue. It serves customers in the healthcare, petroleum refining, manufacturing, food, beverage carbonation, fiber-optics, steel making, aerospace, chemicals, electronics and water treatment industries. The company's primary business is the manufacturing and distribution of atmospheric gases, including oxygen, nitrogen, argon, rare gases, and process gases, including carbon dioxide, helium, hydrogen, electronic gases, specialty gases, and acetylene.",https://i.ibb.co/y0DC5SC/LIN-forecast.png
LYV,Live Nation Entertainment Inc,TRADE & SERVICES,SERVICES-AMUSEMENT & RECREATION SERVICES,NYSE,USD,USA,"9348 CIVIC CENTER DRIVE, BEVERLY HILLS, CA, US","Live Nation Entertainment, Inc is an American global entertainment company, founded in 2010, following the merger of Live Nation and Ticketmaster. The company promotes, operates, and manages ticket sales for live entertainment in the United States and internationally. It also owns and operates entertainment venues, and manages the careers of music artists.",https://i.ibb.co/phJwCfS/LYV-forecast.png
LKQ,LKQ Corporation,TRADE & SERVICES,WHOLESALE-MOTOR VEHICLES & MOTOR VEHICLE PARTS & SUPPLIES,NASDAQ,USD,USA,"500 WEST MADISON STREET, SUITE 2800, CHICAGO, IL, US",LKQ Corporation (Like Kind and Quality) is an American provider of alternative and speciality parts to repair and accessorise automobiles and other vehicles.,https://i.ibb.co/syPTkD7/LKQ-forecast.png
LMT,Lockheed Martin Corporation,MANUFACTURING,GUIDED MISSILES & SPACE VEHICLES & PARTS,NYSE,USD,USA,"6801 ROCKLEDGE DR, BETHESDA, MD, US","Lockheed Martin Corporation is an American aerospace, defense, information security, and technology company with worldwide interests. It is headquartered in North Bethesda, Maryland, in the Washington, D.C., area.",https://i.ibb.co/3r34cQF/LMT-forecast.png
L,Loews Corp,FINANCE,"FIRE, MARINE & CASUALTY INSURANCE",NYSE,USD,USA,"667 MADISON AVE, NEW YORK, NY, US","Loews Corporation is an American conglomerate headquartered in New York City. The company's majority-stake holdings include CNA Financial Corporation, Diamond Offshore Drilling, Boardwalk Pipeline Partners, Loews Hotels and Altium Packaging.",https://i.ibb.co/rkYBVfK/L-forecast.png
LOW,Lowe's Companies Inc,TRADE & SERVICES,RETAIL-LUMBER & OTHER BUILDING MATERIALS DEALERS,NYSE,USD,USA,"1000 LOWE'S BLVD., MOORESVILLE, NC, US","Lowe's Companies, Inc. is an American retail company specializing in home improvement. Headquartered in Mooresville, North Carolina, the company operates a chain of retail stores in the United States and Canada.",https://i.ibb.co/Mp3dyXY/LOW-forecast.png
LUMN,Lumen Technologies Inc,TECHNOLOGY,TELEPHONE COMMUNICATIONS (NO RADIOTELEPHONE),NYSE,USD,USA,"P O BOX 4065, 100 CENTURYTEL DR, MONROE, LA, US","Lumen Technologies (formerly CenturyLink) is an American telecommunications company headquartered in Monroe, Louisiana, that offers communications, network services, security, cloud solutions, voice, and managed services.",https://i.ibb.co/PNtZw1h/LUMN-forecast.png
LYB,LyondellBasell Industries NV,LIFE SCIENCES,INDUSTRIAL ORGANIC CHEMICALS,NYSE,USD,USA,"1221 MCKINNEY ST, SUITE 700, HOUSTON, TX, US","LyondellBasell Industries N.V. (NYSE: LYB) is a Dutch-domiciled multinational chemical company with American and British roots, incorporated in the Netherlands, with U.S. operations headquarters in Houston, Texas, and offices in London, UK. The company is the largest licensor of polyethylene and polypropylene technologies. It also produces ethylene, propylene, polyolefins, and oxyfuels.",https://i.ibb.co/3N4qqdw/LYB-forecast.png
MTB,M&T Bank Corp,FINANCE,STATE COMMERCIAL BANKS,NYSE,USD,USA,"C/O CORPORATE REPORTING, ONE M&T PLAZA 5TH FLOOR, BUFFALO, NY, US","M&T Bank Corporation is an American bank holding company headquartered in Buffalo, New York.",https://i.ibb.co/w6QG6VX/MTB-forecast.png
MRO,Marathon Oil Corporation,ENERGY & TRANSPORTATION,CRUDE PETROLEUM & NATURAL GAS,NYSE,USD,USA,"P O BOX 3128, HOUSTON, TX, US","Marathon Oil Corporation is an American company engaged in hydrocarbon exploration incorporated in Ohio and headquartered in the Marathon Oil Tower in Houston, Texas.",https://i.ibb.co/cYNBsJv/MRO-forecast.png
MPC,Marathon Petroleum Corp,ENERGY & TRANSPORTATION,PETROLEUM REFINING,NYSE,USD,USA,"539 SOUTH MAIN STREET, FINDLAY, OH, US","Marathon Petroleum Corporation is an American petroleum refining, marketing, and transportation company headquartered in Findlay, Ohio.",https://i.ibb.co/Dbm0NQh/MPC-forecast.png
MKTX,MarketAxess Holdings Inc,FINANCE,"SECURITY BROKERS, DEALERS & FLOTATION COMPANIES",NASDAQ,USD,USA,"55 HUDSON YARDS, 15TH FLOOR, NEW YORK, NY, US","MarketAxess Holdings Inc. (MarketAxess) is an international financial technology company that operates an electronic trading platform for the institutional credit markets, and also provides market data and post-trade services.",https://i.ibb.co/DzB221C/MKTX-forecast.png
MAR,Marriott International Inc,REAL ESTATE & CONSTRUCTION,HOTELS & MOTELS,NASDAQ,USD,USA,"10400 FERNWOOD ROAD, BETHESDA, MD, US","Marriott International, Inc. is an American multinational company that operates, franchises, and licenses lodging including hotel, residential, and timeshare properties. It is headquartered in Bethesda, Maryland.",https://i.ibb.co/0n1PJBB/MAR-forecast.png
MMC,Marsh & McLennan Companies Inc,FINANCE,"INSURANCE AGENTS, BROKERS & SERVICE",NYSE,USD,USA,"1166 AVENUE OF THE AMERICAS, NEW YORK, NY, US","Marsh McLennan (formerly known as Marsh & McLennan Companies) is a global professional services firm, headquartered in New York City with businesses in insurance brokerage, risk management, reinsurance services, talent management, investment advisory, and management consulting. Its four main operating companies are Marsh, Guy Carpenter, Mercer, and Oliver Wyman.",https://i.ibb.co/swt7V8p/MMC-forecast.png
MLM,Martin Marietta Materials Inc,ENERGY & TRANSPORTATION,MINING & QUARRYING OF NONMETALLIC MINERALS (NO FUELS),NYSE,USD,USA,"2710 WYCLIFF ROAD, RALEIGH, NC, US","Martin Marietta Materials, Inc. is an American-based company. The company is a supplier of aggregates and heavy building materials, with operations spanning 26 states, Canada and the Caribbean. In particular, Martin Marietta supplies the resources for roads, sidewalks and foundations.",https://i.ibb.co/nPJXvFY/MLM-forecast.png
MAS,Masco Corporation,MANUFACTURING,"HEATING EQUIP, EXCEPT ELEC & WARM AIR; & PLUMBING FIXTURES",NYSE,USD,USA,"17450 COLLEGE PARKWAY, LIVONIA, MI, US",Masco Corporation is a manufacturer of products for the home improvement and new home construction markets.,https://i.ibb.co/JQRW7Vj/MAS-forecast.png
MA,Mastercard Inc,TRADE & SERVICES,"SERVICES-BUSINESS SERVICES, NEC",NYSE,USD,USA,"2000 PURCHASE STREET, PURCHASE, NY, US","Mastercard Incorporated is an American multinational financial services corporation headquartered in the Mastercard International Global Headquarters in Purchase, New York. The Global Operations Headquarters is located in O'Fallon, Missouri, a municipality of St. Charles County, Missouri. Throughout the world, its principal business is to process payments between the banks of merchants and the card-issuing banks or credit unions of the purchasers who use the Mastercard brand debit, credit and prepaid cards to make purchases. Mastercard Worldwide has been a publicly traded company since 2006.",https://i.ibb.co/416RM6Y/MA-forecast.png
MTCH,Match Group Inc,TRADE & SERVICES,"RETAIL-RETAIL STORES, NEC",NASDAQ,USD,USA,"152 WEST 57TH ST, 42ND FLOOR, NEW YORK, NY, US","Match Group, Inc. offers dating products globally. The company is headquartered in Dallas, Texas.",https://i.ibb.co/Czp24g9/MTCH-forecast.png
MKC,McCormick & Company Incorporated,MANUFACTURING,MISCELLANEOUS FOOD PREPARATIONS & KINDRED PRODUCTS,NYSE,USD,USA,"18 LOVETON CIRCLE, P O BOX 6000, SPARKS, MD, US","McCormick & Company is an American multinational food company that manufactures, markets, and distributes spices, seasoning mixes, condiments, and other flavoring products to retail outlets, food manufacturers, and foodservice businesses.",https://i.ibb.co/Dgdm1vm/MKC-forecast.png
MCD,McDonalds Corporation,TRADE & SERVICES,RETAIL-EATING PLACES,NYSE,USD,USA,"110 NORTH CARPENTER STREET, CHICAGO, IL, US","McDonald's Corporation is an American fast food company, founded in 1940 as a restaurant operated by Richard and Maurice McDonald, in San Bernardino, California, United States. They rechristened their business as a hamburger stand, and later turned the company into a franchise, with the Golden Arches logo being introduced in 1953 at a location in Phoenix, Arizona.",https://i.ibb.co/wR6wGVD/MCD-forecast.png
MCK,McKesson Corporation,TRADE & SERVICES,"WHOLESALE-DRUGS, PROPRIETARIES & DRUGGISTS' SUNDRIES",NYSE,USD,USA,"6555 STATE HIGHWAY 161, IRVING, TX, US","McKesson Corporation is an American company distributing pharmaceuticals and providing health information technology, medical supplies, and care management tools.",https://i.ibb.co/MGmYvJB/MCK-forecast.png
MDT,Medtronic PLC,LIFE SCIENCES,ELECTROMEDICAL & ELECTROTHERAPEUTIC APPARATUS,NYSE,USD,USA,"20 ON HATCH, LOWER HATCH STREET, DUBLIN, IE","Medtronic plc is an American-Irish registered medical device company that primarily operates in the United States. Medtronic has an operational and executive headquarters in Fridley, Minnesota in the US.",https://i.ibb.co/87DD8yH/MDT-forecast.png
MRK,Merck & Company Inc,LIFE SCIENCES,PHARMACEUTICAL PREPARATIONS,NYSE,USD,USA,"2000 GALLOPING HILL ROAD, KENILWORTH, NJ, US","Merck & Co. is an American multinational pharmaceutical company headquartered in Kenilworth, New Jersey. It is named after the Merck family, which set up Merck Group in Germany in 1668.",https://i.ibb.co/Fq3nNcf/MRK-forecast.png
MET,MetLife Inc,FINANCE,LIFE INSURANCE,NYSE,USD,USA,"200 PARK AVENUE, NEW YORK, NY, US","MetLife, Inc. is the holding corporation for the Metropolitan Life Insurance Company (MLIC), better known as MetLife, and its affiliates. MetLife is among the largest global providers of insurance, annuities, and employee benefit programs, with 90 million customers in over 60 countries.",https://i.ibb.co/gjhqj0L/MET-forecast.png
MTD,Mettler-Toledo International Inc,LIFE SCIENCES,LABORATORY ANALYTICAL INSTRUMENTS,NYSE,USD,USA,"1900 POLARIS PARKWAY, COLUMBUS, OH, US","Mettler Toledo (NYSE: MTD) is a multinational manufacturer of scales and analytical instruments. It is the largest provider of weighing instruments for use in laboratory, industrial, and food retailing applications. The company also provides various analytical instruments, process analytics instruments, and end-of-line inspection systems.",https://i.ibb.co/2hn0yt0/MTD-forecast.png
MGM,MGM Resorts International,REAL ESTATE & CONSTRUCTION,HOTELS & MOTELS,NYSE,USD,USA,"3600 LAS VEGAS BLVD S, LAS VEGAS, NV, US",MGM Resorts International is an American global hospitality and entertainment company operating destination resorts globally.,https://i.ibb.co/KjWmNSL/MGM-forecast.png
MCHP,Microchip Technology Inc,MANUFACTURING,SEMICONDUCTORS & RELATED DEVICES,NASDAQ,USD,USA,"2355 W CHANDLER BLVD, CHANDLER, AZ, US","Microchip Technology Inc. is a publicly-listed American corporation that manufactures microcontroller, mixed-signal, analog and Flash-IP integrated circuits.",https://i.ibb.co/C0Ghj7f/MCHP-forecast.png
MU,Micron Technology Inc,MANUFACTURING,SEMICONDUCTORS & RELATED DEVICES,NASDAQ,USD,USA,"8000 S FEDERAL WAY, PO BOX 6, BOISE, ID, US","Micron Technology, Inc. is an American producer of computer memory and computer data storage including dynamic random-access memory, flash memory, and USB flash drives. It is headquartered in Boise, Idaho.",https://i.ibb.co/yYjQx0q/MU-forecast.png
MSFT,Microsoft Corporation,TECHNOLOGY,SERVICES-PREPACKAGED SOFTWARE,NASDAQ,USD,USA,"ONE MICROSOFT WAY, REDMOND, WA, US","Microsoft Corporation is an American multinational technology company which produces computer software, consumer electronics, personal computers, and related services. Its best known software products are the Microsoft Windows line of operating systems, the Microsoft Office suite, and the Internet Explorer and Edge web browsers. Its flagship hardware products are the Xbox video game consoles and the Microsoft Surface lineup of touchscreen personal computers. Microsoft ranked No. 21 in the 2020 Fortune 500 rankings of the largest United States corporations by total revenue; it was the world's largest software maker by revenue as of 2016. It is considered one of the Big Five companies in the U.S. information technology industry, along with Google, Apple, Amazon, and Facebook.",https://i.ibb.co/fMC3S3m/MSFT-forecast.png
MAA,Mid-America Apartment Communities Inc,REAL ESTATE & CONSTRUCTION,REAL ESTATE INVESTMENT TRUSTS,NYSE,USD,USA,"6815 POPLAR AVENUE, SUITE 500, GERMANTOWN, TN, US","Mid-America Apartment Communities (MAA) is a publicly traded real estate investment trust based in Memphis, Tennessee that invests in apartments in the Southeastern United States and the Southwestern United States.",https://i.ibb.co/DzqtBJV/MAA-forecast.png
MRNA,Moderna Inc,LIFE SCIENCES,"BIOLOGICAL PRODUCTS, (NO DISGNOSTIC SUBSTANCES)",NASDAQ,USD,USA,"200 TECHNOLOGY SQUARE, CAMBRIDGE, MA, US","Moderna, Inc., a biotechnology company, develops messenger RNA-based vaccines and therapies for the treatment of infectious diseases, immuno-oncology, rare diseases, cardiovascular diseases, and autoimmune diseases. The company is headquartered in Cambridge, Massachusetts.",https://i.ibb.co/grqfMHL/MRNA-forecast.png
MHK,Mohawk Industries Inc,MANUFACTURING,CARPETS & RUGS,NYSE,USD,USA,"160 S INDUSTRIAL BLVD, PO BOX 12069, CALHOUN, GA, US","Mohawk Industries is an American flooring manufacturer based in Calhoun, Georgia, United States. Mohawk produces floor covering products for residential and commercial applications in North America and residential applications in Europe.",https://i.ibb.co/fXkDNSq/MHK-forecast.png
TAP,Molson Coors Brewing Co Class B,MANUFACTURING,MALT BEVERAGES,NYSE,USD,USA,"P.O. BOX 4030, NH353, GOLDEN, CO, US","The Molson Coors Beverage Company, commonly known as Molson Coors, is a multinational drink and brewing company headquartered in Chicago in the United States.",https://i.ibb.co/nPxBnMG/TAP-forecast.png
MDLZ,Mondelez International Inc,MANUFACTURING,FOOD AND KINDRED PRODUCTS,NASDAQ,USD,USA,"905 WEST FULTON MARKET, SUITE 200, CHICAGO, IL, US","Mondelez International, Inc. is an American multinational confectionery, food, holding and beverage and snack food company based in Chicago, Illinois.",https://i.ibb.co/DkNdFQL/MDLZ-forecast.png
MPWR,Monolithic Power Systems Inc,MANUFACTURING,SEMICONDUCTORS & RELATED DEVICES,NASDAQ,USD,USA,"5808 LAKE WASHINGTON BLVD. NE, KIRKLAND, WA, US","Monolithic Power Systems, Inc. is an American, publicly traded company headquartered in Kirkland, Washington. The company provides power circuits for systems found in cloud computing, telecom infrastructures, automotive, industrial applications and consumer applications.",https://i.ibb.co/nwsXpDp/MPWR-forecast.png
MNST,Monster Beverage Corp,MANUFACTURING,BOTTLED & CANNED SOFT DRINKS & CARBONATED WATERS,NASDAQ,USD,USA,"1 MONSTER WAY, CORONA, CA, US","Monster Beverage Corporation is an American beverage company that manufactures energy drinks including Monster Energy, Relentless and Burn.",https://i.ibb.co/kxjGwp1/MNST-forecast.png
MCO,Moodys Corporation,TRADE & SERVICES,"SERVICES-CONSUMER CREDIT REPORTING, COLLECTION AGENCIES",NYSE,USD,USA,"7 WORLD TRADE CENTER, AT 250 GREENWICH STREET, NEW YORK, NY, US","Moody's Corporation, often referred to as Moody's, is an American business and financial services company. It is the holding company for Moody's Investors Service (MIS), an American credit rating agency, and Moody's Analytics (MA), an American provider of financial analysis software and services.",https://i.ibb.co/L5ScQDT/MCO-forecast.png
MS,Morgan Stanley,FINANCE,"SECURITY BROKERS, DEALERS & FLOTATION COMPANIES",NYSE,USD,USA,"1585 BROADWAY, NEW YORK, NY, US","Morgan Stanley is an American multinational investment bank and financial services company headquartered at 1585 Broadway in the Morgan Stanley Building, Midtown Manhattan, New York City.",https://i.ibb.co/bQp19gm/MS-forecast.png
MSI,Motorola Solutions Inc,MANUFACTURING,RADIO & TV BROADCASTING & COMMUNICATIONS EQUIPMENT,NYSE,USD,USA,"500 W. MONROE ST., CHICAGO, IL, US","Motorola Solutions, Inc., is an American data communications and telecommunications equipment provider that succeeded Motorola, Inc., following the spinoff of the mobile phone division into Motorola Mobility in 2011. The company is headquartered in Chicago, Illinois.",https://i.ibb.co/3mDvrzK/MSI-forecast.png
MSCI,MSCI Inc,TRADE & SERVICES,"SERVICES-BUSINESS SERVICES, NEC",NYSE,USD,USA,"7 WORLD TRADE CENTER, 250 GREENWICH STREET, 49TH FLOOR, NEW YORK, NY, US","MSCI Inc. (formerly Morgan Stanley Capital International and MSCI Barra), is an American finance company headquartered in New York City and serving as a global provider of equity, fixed income, hedge fund stock market indexes, multi-asset portfolio analysis tools and ESG products. It publishes the MSCI BRIC, MSCI World and MSCI EAFE Indexes.",https://i.ibb.co/9Z7wL2n/MSCI-forecast.png
NDAQ,Nasdaq Inc,FINANCE,"SECURITY & COMMODITY BROKERS, DEALERS, EXCHANGES & SERVICES",NASDAQ,USD,USA,"151 W. 42ND STREET, NEW YORK, NY, US","Nasdaq, Inc. is an American multinational financial services corporation that owns and operates stock exchanges in the United States and Europe. It is headquartered in New York City.",https://i.ibb.co/pXRGLvt/NDAQ-forecast.png
NTAP,NetApp Inc,TECHNOLOGY,COMPUTER STORAGE DEVICES,NASDAQ,USD,USA,"1395 CROSSMAN AVENUE, SUNNYVALE, CA, US","NetApp, Inc. is an American hybrid cloud data services and data management company headquartered in Sunnyvale, California. Founded in 1992 with an IPO in 1995, NetApp offers cloud data services for management of applications and data both online and physically.",https://i.ibb.co/KjTS1Zw/NTAP-forecast.png
